47,>>> Israel 2017,Israeli political marketing firm the Archimedes Group targeted audiences around the world with inauthentic Facebook assets to influence elections and establish local audiences. The commercial network targeted at least 13 countries; their assets were followed by over 2.8 million users.,2017,,,2019,May,Clearly stated campaign ended within time frame,2019,May,"Inauthentic Israeli Facebook Assets Target the World. Medium, DFRLab. May 17, 2019. https://medium.com/dfrlab/inauthentic-israeli-facebook-assets-target-the-world-281ad7254264",https://medium.com/dfrlab/inauthentic-israeli-facebook-assets-target-the-world-281ad7254264,,,Oldest pages created in 2017 as seen from screenshots of Facebook transparency pages.,,West Africa,,"The network targeted at least 13 countries around the world, including countries in Africa, Latin America, and Southeast Asia. Africa is coded as the primary target because Nigeria, Niger, Mali, Ghana, Togo, Algeria, Angola, and Mozambique were all explicitly targeted by country-specific Facebook pages. Additionally, Africa as a whole was targeted through Facebook pages like ""L’Afrique Cachée"" (""The Hidden Africa"").",1,,1,,,,1,1,,"Government - Civilian (binary) = messaging in support of incumbent Nigerian President
Political Party (binary) = messaging in opposition to incumbent Nigerian president
Electorate (binary) = false watch political violence and disinformation watchdogs target media consumers. Inauthentic news media outlets. Fake data ex-filtration pages alleging African corruption. Inaccurate regional specific depictions of target nations.
Racial, Ethnic, Religious, or Sexual Identity Group (binary) = messaging designed for Nigerian Muslim population
",No Data,No Data,No Data,No Data,No Data,No Data,,,No Data,No Data,No Data,No Data,No Data,No Data,No Data,No Data,No Data,No Data,No Data,No Data,No Data,No Data,,,,,1,,,"Federal Elections = February 2019 Nigerian presidential elections, which were a specific target of some Facebook pages.",,Central America,,"Regional Bloc (bloc) = Honduras, Mexico",,,,,,,,1,1,,,,,,,,,,,,,,,,,,256 Facebook and Instagram assets,"French, Spanish, English",1,,1,1,,,,,,,,Disinformation,,,1,,,,,,,,,1,1,,1,,,Destructive - Discredit (binary) = Pages designed to expose alleged corruption,Israel,,,"Archimedes Group is an Israeli political marketing firm that claims to run “winning campaigns worldwide,” indicating both the political and global scope of its activities.",,,,,1,,,,,,-0.79,2016,-0.89,2017,-0.93,2018,,,0,2017,0.79,2016,0.7,2017,No Data,No Data,No Data,No Data,No Data,No Data,No Data,No Data,,,,,,,,,,,,,,,,,"To push political and region specific messaging on behalf of clients, presumably around the world, for financial incentives.",,,,,,
48,Indonesia >>> ---,"Ahead of Indonesia's April 2019 election, several Facebook pages were removed for ""coordinated inauthentic behavior."" The pages shared content that targeted the incumbent President Joko Widodo and supported his political rival Prabowo Subianto.",,,,2019,April,Clearly stated campaign ended within time frame,2019,April,"#ElectionWatch: Facebook Takes Down Network Supporting Indonesian Presidential Candidate Prabowo Subianto. Medium, DFRLab. April 12, 2019. https://medium.com/dfrlab/electionwatch-facebook-takes-down-network-supporting-indonesian-presidential-candidate-prabowo-18b8792e9529",https://medium.com/dfrlab/electionwatch-facebook-takes-down-network-supporting-indonesian-presidential-candidate-prabowo-18b8792e9529,,,,Indonesia,,,,1,,,,,,1,,,The pages targeted incumbent President Joko Widodo ahead of the April 2019 election.,No Data,No Data,No Data,No Data,No Data,No Data,,,No Data,No Data,No Data,No Data,No Data,No Data,No Data,No Data,No Data,No Data,No Data,No Data,No Data,No Data,,,,,1,,,Federal Elections = April 2019 Indonesian presidential election,,,,,,,,,,,,1,,,,,,,,,,,,,,,,,,,234 facebook assets,"English, Chinese, Russian, Indonesian",1,,,1,,,,1,,,,,,,1,,,,,,,,,,1,,1,,,,,,,,,,,,,,,,,,No Data,No Data,No Data,No Data,No Data,No Data,,,No Data,No Data,No Data,No Data,No Data,No Data,No Data,No Data,No Data,No Data,No Data,No Data,No Data,No Data,,,,,,,,,,,,,,,,,To denounce the incumbent and support his rival ahead of the April 2019 Indonesian presidential election.,1,,,,the campaign's proximity to the elections did contribute to its potential to spread false or divisive messaging.,
49,Venezuela >>> Venezuela 2019,"Venezuelan civilian militias used institutional accounts to manipulate Twitter traffic in an effort to make pro-Maduro hashtags trend in the country. Maduro reciprocated, calling for more Venezuelans to join militias.",2019,April,Clearly stated campaign start within time frame,2019,April,Clearly stated campaign ended within time frame,2019,May,"Civilian Militias in Venezuela Coordinate on Twitter. Medium, DFRLab. May 1, 2019. https://medium.com/dfrlab/civilian-militias-in-venezuela-coordinate-on-twitter-aadcd86d6186",https://medium.com/dfrlab/civilian-militias-in-venezuela-coordinate-on-twitter-aadcd86d6186,,,,Venezuela,,,,,,,,,,1,,,Electorate (binary) = Messaging tailored to support Maduro in response to opposition leader Juan Guaidó.,-1.34,2018,No Data,No Data,No Data,No Data,,,No Data,No Data,No Data,No Data,No Data,No Data,No Data,No Data,66,2018,No Data,No Data,No Data,No Data,,,,,,,contentious election of Nicolas Maduro and announcements by Maduro's opposition leader Juan Guaidó.,"The attempt to manipulate Twitter traffic happened as the leader of the country, Nicolas Maduro, who has led Venezuela since the passing of Hugo Chavez in 2013, called for a million more Venezuelans to join the militia before the end of the year.",,,,,,,,,,,,,,1,,,,,,,,,,,,,,,,,"The DFRLab analyzed three hashtags that were amplified possibly artificially. This hashtag #somostodosmilicia (“We are all militia”) was mentioned 4,001 times between April 12 and 14. #Rumboalos3milliones was used 4,163 times between April 7 and 23. #miliciapuebloenarmas used 1,528 times between April 10 and 16.",Spanish,1,1,,,,,,,,,,,,1,,1,,,,,,,"While there was evidence of traffic manipulation on Twitter, it is unclear whether or not some of the accounts using the hashtag are fake. Many of the accounts tweeting are real militia accounts.",1,1,,,,,,Venezuela,,,Members of the Venezuelan militia used their institutional Twitter accounts to manipulate Twitter traffic.,,1,,,,,,,,,-1.34,2018,No Data,No Data,No Data,No Data,,,No Data,No Data,No Data,No Data,No Data,No Data,No Data,No Data,66,2018,No Data,No Data,No Data,No Data,,,,,,,Maduro-Guaido conflict,,,,,,,,,,"To promote Nicolas Maduro as the leader of Venezuela in response to messaging from Juan Guaidó and the Venezuelan military. To match and counter threats by Maduro opposition who purported to embark on the ""final phase"" to remove Maduro. To associate with and promote the role of civilian militia forces in Venezuela.",1,,,1,To saturate the information space around anit-Maduro narratives with reminders of civilian militia loyalty to the interim president.,
50,Malaysia >>> --- 2018,"Ahead of the Malaysian general elections, Twitter bots launched two hashtag campaigns in defense of an opposition coalition of center left parties.",2018,April,Clearly stated campaign start within time frame,2018,,,2018,April,"#BotSpot: Bots Target Malaysian Elections. Medium, DFRLab. April 20, 2018. https://medium.com/dfrlab/botspot-bots-target-malaysian-elections-785a3c25645b",https://medium.com/dfrlab/botspot-bots-target-malaysian-elections-785a3c25645b,,,,Malaysia,,,,,,,,,,1,,,,0.12,2017,0.24,2018,No Data,No Data,,,No Data,No Data,-0.4,2017,No Data,No Data,No Data,No Data,44,2017,45,2018,No Data,No Data,,,,,1,,,"Federal Election (binary) = May 9, 2019 general election",,,,,,,,,,,,,,1,,,,,,,,,,,,,,,,,"Two hashtags — #SayNOtoPH and #KalahkanPakatan — were used 44,100 times by 17,600 Twitter users. 17,000 of those users were bots. The campaign reached more than 300,000 users.",Malay,,,1,,,,,,,,,,,,,1,,,,,,,,,,,1,,,,,,,No certain attribution can be made but the content appears to be overtly supportive of the Barisan Nasional party. Bot herder profiles are Russian sounding Cyrillic screen names,,,,,,,,,,,No Data,No Data,No Data,No Data,No Data,No Data,,,No Data,No Data,No Data,No Data,No Data,No Data,No Data,No Data,No Data,No Data,No Data,No Data,No Data,No Data,,,,,,,,,,,,,,,,,"To denounce the opposition party in the time leading up Malaysia's 2019 general elections. Accounts remained largely within their network and were, for the most part, ineffective at gaining an organic following.",1,,,,,
51,Latin America >>> Iran 2016,Network of Facebook assets frequently re-purposed Iranian state media targeting Latin American and United States audiences.,2016,August,,2019,October,Clearly stated campaign ended within time frame,2019,October,"“Facebook Takes down Iranian Assets, Some Targeting Latin American Audiences.” DFRLab, Medium. October 24, 2019. https://medium.com/dfrlab/facebook-takes-down-iranian-assets-some-targeting-latin-american-audiences-58a964dc0597.",https://medium.com/dfrlab/facebook-takes-down-iranian-assets-some-targeting-latin-american-audiences-58a964dc0597,,,,,Latin America,,"The campaign spanned countries, targeting many specific countries in Latin America, including Venezuela, Brazil, Argentina, Bolivia, Peru, Ecuador, and Mexico.",,,,,,,1,,,,No Data,No Data,No Data,No Data,No Data,No Data,,,No Data,No Data,No Data,No Data,No Data,No Data,No Data,No Data,No Data,No Data,No Data,No Data,No Data,No Data,,,,,,,,,United States,,,One of the pages the DFRLab analyzed seemingly promoting the Black Lives Matter movement (“BLMNews”) in the United States.,,,,,,,1,1,,,,,,,,,,,,,,,,,,,"In total, the five pages the DFRLab analyzed had 14,605 followers and 13,943 likes. One page linked to a junk news site, BLMnews.com, that was hosted in Iran.","Spanish, English",1,1,,,1,,,,1,,1,,,,1,,,,,,,,,,1,,1,,,,Iran,,,"One of the websites was hosted in Iran, and the page mangers of the Facebook assets were located in Iran. Some of the content referred to Iranian state-sponsored communications.",,1,,,,,,,Government - Proxy/Inferred Attribution,,-1.31,2015,-0.81,2016,-0.93,2017,,,-0.2,2016,-1.51,2015,-1.34,2016,-1.3,2017,87,2015,87,2016,85,2017,,,,,,,,,,,,,,,,,"To spread pro-Iranian messaging mixed in with region specific topics in the Americas. To take aim at American interests abroad, criticizing Israel and pushing the BDS movement. To target Latin American audiences on Iranian Spanish speaking media outlets such as HispanTV and on Spanish language Facebook pages.",,1,,,To spread Iranian friendly sentiments in the Americas,
52,India >>> --- 2019,Sock-puppet accounts appeared amid increased public attention to the India's space agency following an unsuccessful attempt at a lunar landing. Accounts interspersed false reporting with factual content about ongoing developments.,2019,,Clearly stated campaign start within time frame,2019,September,Clearly stated campaign ended within time frame,2019,November,"“Sockpuppet Accounts Impersonate India’s Space Agency Chief.” Medium, DFRLab. November 18, 2019. https://medium.com/dfrlab/sockpuppet-accounts-impersonate-indias-space-agency-chief-7fc2c1980f13.",https://medium.com/dfrlab/sockpuppet-accounts-impersonate-indias-space-agency-chief-7fc2c1980f13,,,,India,,,,,,,,,,1,,,"The sockpuppet Twitter accounts impersonated Dr. Kailasavadivoo Sivan, the chairman of India’s national space agency.",-0.96,2018,No Data,No Data,No Data,No Data,,,No Data,No Data,No Data,No Data,No Data,No Data,No Data,No Data,43,2018,No Data,No Data,No Data,No Data,,,,,,,Failed attempt at lunar landing by the Indian space agency or ISRO,"The appearance of the fake accounts coincided with the start of India’s first lunar landing. The lander was set to touch down on the far side of the moon but, as the lander descended, lost contact with the control room around 2 kilometers above the surface.",,,,,,,,,,,,,,1,,,,,,,,,,,,,,,,,"The sockpuppet Twitter accounts made it onto lists by actual news sites, including the Times of India, Indian Express, and BoomLive.","English, Hindi",1,,1,,,,,,,,,Indian lunar landing attempt,,,1,,,,,,,,,,,,,1,,"Oblique - Troll (binary) = Infiltrated the narratives impersonating as a high profile official, interspersing reporting with false narratives.",,,,,,,,,,,,,,,No Data,No Data,No Data,No Data,No Data,No Data,,,No Data,No Data,No Data,No Data,No Data,No Data,No Data,No Data,No Data,No Data,No Data,No Data,No Data,No Data,,,,,,,,,,,,,,,,,"Intent is unclear, outside of promoting BJP officials and talking points. It is not uncommon for high profile events, such as a moon landing to be used as a vector to interject divisive content into an ongoing conversation.",,1,,,,
53,Greenland >>> --- 2019,"One-off accounts used English and Russian self-publishing platforms, targeting U.S. President Donald Trump's attempts to buy Greenland by way of fabricated government document - a letter sent on the official letterhead of Greenland.",2019,November,Clearly stated campaign start within time frame,2019,,,2019,November,"“Secondary Infektion Redux? Suspected Russian Intelligence Operation Targets Greenland.” Medium, DFRLab. November 13, 2019. https://medium.com/dfrlab/secondary-infektion-redux-suspected-russian-intelligence-operation-targets-greenland-c4e04deb27c5.",https://medium.com/dfrlab/secondary-infektion-redux-suspected-russian-intelligence-operation-targets-greenland-c4e04deb27c5,,,,Greenland,,,,,,,,,,1,,,"The content also spread on Eastern European blogging and media outlets in Ukraine and Latvia, suggesting that Russian-language speakers in these countries were another possible target.",1.94,2018,No Data,No Data,No Data,No Data,,,No Data,No Data,No Data,No Data,No Data,No Data,No Data,No Data,No Data,No Data,No Data,No Data,No Data,No Data,,,,,,,American President Trump offered to buy Greenland in August 2019,,,,,,,,,,,,1,1,,,,,1,,1,Indybay.org,,,,,,,,,,,"The false article originally appeared on the self-publishing platform Indybay.org. The same day, a Reddit account posted the story. The article gained some engagement on Facebook; the article translated in Russian was also shared on perevodika.ru and Yandex Zen. The article was also published on a Latvian regional website called D Fakti, an Azerbaijani web forum called Disput.az, and in a Ukrainina regional media outlet named Berdichevsky Poglyad. For most of these platform, the accounts posted the article solely and have not posted before or since, suggesting a high level of operational security in a possible intelligence operation.","English, Russian",1,,,,,,,,,,,,,,,,,,,,1,,Deceptive Content Manipulation (binary) = fake government document,,,,,1,,,,,,"Attribution is inferred to Russia. As with the forged documents in Operation Secondary Infektion, the letter contained many grammar errors and stylistic mistakes that are not characteristic to official correspondence and that resemble those commonly made by native Russian speakers with an intermediate grasp of English.",,,,,,,,,,,No Data,No Data,No Data,No Data,No Data,No Data,,,No Data,No Data,No Data,No Data,No Data,No Data,No Data,No Data,No Data,No Data,No Data,No Data,No Data,No Data,,,,,,,,,,,,,,,,,"To sow discord in Greenland and among Russian-language speakers in Eastern Europe, convincing them that the US was attempting to buy Greenland.",,1,,,,
54,Spain >>> Spain 2019,"Facebook and Twitter removed over 300 accounts run by the conservative Partido Popular party, one of Spain's major political parties, for inauthentic behavior.",2019,,,2019,September,Clearly stated campaign ended within time frame,2019,October,"“Facebook and Twitter Remove Accounts Connected to Spanish Political Party.” Medium, DFRLab. October 2,2019. https://medium.com/dfrlab/facebook-and-twitter-remove-accounts-connected-to-spanish-political-party-9218db0a3d95.",https://medium.com/dfrlab/facebook-and-twitter-remove-accounts-connected-to-spanish-political-party-9218db0a3d95,,,,Spain,,,,1,,,,,,1,,,,0.25,2018,No Data,No Data,No Data,No Data,,,No Data,No Data,No Data,No Data,No Data,No Data,No Data,No Data,No Data,No Data,No Data,No Data,No Data,No Data,,,,,1,,,"The removal of the accounts occurred amid political instability in Spain. In the country’s April general elections, Prime Minister Pedro Sanchéz and his center-left PSOE (“Socialist Workers’ Party of Spain”) won the most seats but failed to gain an outright majority of votes, which would have allowed it to govern by itself. PSOE then failed to form a coalition, and, as such, Spain is thus headed for another vote in November 2019.",,,,,,,,,,,,1,1,1,,,,,,,1,,,,,,,,,,An assessment of URLs tweeted by the Twitter accounts revealed that the accounts amplified an invitation to an official WhatsApp channel run by the party.,Spanish,1,,1,,,,,,,,,,,1,1,,,,,,,,"Some of the accounts taken down were real users who worked for the PP. Other accounts were fake, designed to look as if they were real people. The fake Facebook accounts were primarily used to amplify the content (pages and posts) of other Facebook assets.",,1,1,,,,,Spain,,,The network of inauthentic activity was linked to the PP.,,,1,,,,,,,,0.25,2018,No Data,No Data,No Data,No Data,,,No Data,No Data,No Data,No Data,No Data,No Data,No Data,No Data,No Data,No Data,No Data,No Data,No Data,No Data,,,,,1,,,"The removal of the accounts occurred amid political instability in Spain. In the country’s April general elections, Prime Minister Pedro Sanchéz and his center-left PSOE (“Socialist Workers’ Party of Spain”) won the most seats but failed to gain an outright majority of votes, which would have allowed it to govern by itself. PSOE then failed to form a coalition, and, as such, Spain is thus headed for another vote in November 2019.",,,,,,,,,To artificially boost support for the PP online ahead of Spain's 2019 November election.,1,,,,,
55,Macedonia >>> Albania 2018,"Coordinated spam accounts uniformly commented on the Macedonian government's Facebook page. The spam accounts advocating for equal rights for Albanians in Macedonia were quickly removed, presumably by Facebook's automated content review system.",2018,December,Clearly stated campaign start within time frame,2019,January,Clearly stated campaign ended within time frame,2019,January,"“Coordinated Comments in Macedonia” Medium, DFRLab. January 21, 2019. https://medium.com/dfrlab/coordinated-comments-in-macedonia-517fe904359b.",https://medium.com/dfrlab/coordinated-comments-in-macedonia-517fe904359b,,,,Macedonia,,,,1,,,,,,1,,,The spam comments were on a Facebook post made by the Macedonian government's Facebook page.,No Data,No Data,No Data,No Data,No Data,No Data,,,No Data,No Data,No Data,No Data,No Data,No Data,No Data,No Data,No Data,No Data,No Data,No Data,No Data,No Data,,,,,,,International solidarity day in Macedonia,"The Facebook post, which was subjected to spam comments, was written in celebration of International Solidarity Day.",,,,,,,,,,,,1,,,,,,,,,,,,,,,,,,,"The comments were quickly removed, presumably by Facebook’s automated or content review systems.",Albanian,1,,,,,,,1,,,,Equal rights,,1,,,,,,,,,The DFRLab's analysis of the profiles of the commenters indicated that they were authentic accounts.,,,,,,1,Oblique - Flood (binary) = Spam attack in the comments section of a government Facebook post.,Albania,,,The DFRLab's analysis of the profiles of commenters indicated that they were of Albanian origin.,,,,,,,,,,,0.38,2017,0.38,2018,No Data,No Data,,,No Data,No Data,0.2,2017,No Data,No Data,No Data,No Data,No Data,No Data,No Data,No Data,No Data,No Data,,,,,,,,,,,,,,,,,A to hijack the national solidarity day movement to emphasize the role of Albanians in the Macedonian population and draw attention to the prisoners of the 2015 Kumanovo incident.,1,1,,,,
56,>>> Turkey 2019,"As Turkey prepared to take large swaths of northeast Syria in October 2019 after the removal of American troops from the region, bot-like pro-Turkish Twitter accounts waged a concurrent disinformation campaign which demonized Syrian Kurds and the Kurdistan Worker's Party (PKK).",2019,October,Clearly stated campaign start within time frame,2019,,,2019,October,"“Bot-like Turkish Accounts Complement Military Operation in Syria.” Medium, DFRLab. October 16, 2019. https://medium.com/dfrlab/bot-like-turkish-accounts-wage-anti-kurdish-hashtag-campaign-9b1a2908f5b3.",https://medium.com/dfrlab/bot-like-turkish-accounts-wage-anti-kurdish-hashtag-campaign-9b1a2908f5b3,,,,,,,"The target of this campaign was also likely global, since one language used was English.",,,,1,,,,1,,"Non-State Political Actor (binary) = YPG and PKK forces.
Racial, Ethnic, Religious, or Sexual Identity Group (binary) = Kurdish Syrians.",No Data,No Data,No Data,No Data,No Data,No Data,,,No Data,No Data,No Data,No Data,No Data,No Data,No Data,No Data,No Data,No Data,No Data,No Data,No Data,No Data,,,,,,,Turkish advances into North East Syria,An October 2019 executive order from the American President removed US troops from northeastern Syria. Turkish forces in northeastern Syria bombarded the Kurdish militia allied with the United States in its counter-Islamic State campaign.,,,,,,,,,,,,,,1,,,,,,,,,,,,,,,,,"#BabyKillerPKK began trending on Twitter in Turkey on October 10, 2019, registering roughly 118,000 mentions over a period of 12 hours.","English, Turkish",,1,,,1,,,1,1,1,,,,,,1,,,,,,,The accounts were likely bots.,1,,,1,,1,,Turkey,,,"The accounts perpetuating the hashtag were likely Turkish in origin, according to the DFRLab's analysis.",,1,,,,,,,,,-1.33,2018,No Data,No Data,No Data,No Data,,,No Data,No Data,No Data,No Data,No Data,No Data,No Data,No Data,66,2018,No Data,No Data,No Data,No Data,,,,,,,Turkish offensive into North East Syria,,,,,,,,,,Campaign designed to saturate the information space around the Turkish offensive into north east Syria. To change opionions about the Kurdish defending forces and bolster positive sentiments around the Turkish attacking forces.,1,,,1,,
57,Egypt >>> Egypt 2018,Facebook and Instagram assets associated with the Egyptian newspaper El Fagr were removed for coordinated inauthentic behavior after they masqueraded as regional news outlets and amplified divisive political content.,2018,December,,2019,October,Clearly stated campaign ended within time frame,2019,October,"“Facebook Removes Assets Connected to Egyptian Newspaper El Fagr.” Medium, DFRLab. October 15, 2019. https://medium.com/dfrlab/facebook-removes-assets-connected-to-egyptian-newspaper-el-fagr-7ff5e5b41f78.",https://medium.com/dfrlab/facebook-removes-assets-connected-to-egyptian-newspaper-el-fagr-7ff5e5b41f78,,,,Egypt,,,"Egypt coded as primary target because many of the inauthentic assets amplified content on domestic news and political topics. However, other countries were also targeted.",,,,,,,1,,,,-1.42,2017,-1.16,2018,No Data,No Data,,,No Data,No Data,-1.25,2017,No Data,No Data,No Data,No Data,68,2017,72,2018,No Data,No Data,,,,,,,Protests,Anti-government protests in Egypt in September and October 2019 against President Abdel Fattah el-Sisi,,Middle East and North Africa (MENA),,"A significant portion of the inauthentic pages associated with El Fagr focused on various other countries in the Middle East and North Africa, including Yemen, Somalia, Sudan, Tunisia, and Saudi Arabia. These pages masqueraded as independent local and regional outlets, even though they were linked to El Fagr.",,,,,,1,,1,1,,,,,,,,,,,,,,,,,,,Arabic,1,1,,,,,,,,,,,,,1,,,,,,,,"Some pages were directly linked to El Fagr, while other pages masqueraded as regional news outlets in other countries.",,1,1,,,,"Constructive - Astroturf (binary) = engagement ranging from 90 - 17,000 on page content represents CIB to feign interest in site content.",Egypt,,,"The pages were managed from Egypt, and some of the pages were directly linked to Mostafa Thabet, the Editor-in-Chief of El Fagr.",,,,,1,1,,,,,No Data,No Data,-1.16,2018,No Data,No Data,,,No Data,No Data,-1.25,2017,No Data,No Data,No Data,No Data,68,2017,72,2018,No Data,No Data,,,,,,,Protests,Anti-government protests in Egypt in September and October 2019 against President Abdel Fattah el-Sisi.,,,,,,,,,"To spread anti-Qatari, Iranian, and Houthi narratives while supporting the Egyptian government under el-Sisi",1,1,,,,
