12,Indonesia >>> Iran 2016,"A Facebook campaign re-posted Iranian state media messages, directing Facebook users to off platform sites that published identical content with pro-Iranian, pro-Hezbollah, anti-Israel, and anti-U.S. messages.",2016,,,2019,March,Clearly stated campaign ended within time frame,2019,March,"IN DEPTH: Iranian Propaganda Network Goes Down. Medium. DFRLab, March 26, 2019. https://medium.com/dfrlab/takedown-details-of-the-iranian-propaganda-network-d1fad32fdf30",https://medium.com/dfrlab/takedown-details-of-the-iranian-propaganda-network-d1fad32fdf30,,,,Indonesia,,,"While the campaign spanned multiple regions and continents, most targeted Facebook assets targeted Indonesia specifically.",,,,,,,1,,,Some Facebook pages were specifically targeted to Indonesian users.,-0.62,2015,-0.37,2016,-0.5,2017,,,1.1,2016,0.18,2015,0.17,2016,0.13,2017,42,2015,44,2016,47,2017,,,,,,,,,India,,,"While the campaign spanned multiple regions and continents, India was the second most targeted country. For example, one Facebook page was created to build an Indian audience by posting about an Indian cricket star, and then repurposed to pass that audience Iranian messaging.",,East and West Africa,,"While the campaign spanned multiple regions and continents, East Africa and West Africa were explicitly mentioned as targeted areas in the text. Hausa was one of the languages used by at least one Facebook asset, and information propagated about the detention of Nigerian Shia leader Ibrahim Zakzaky.",,,1,1,,,,,,,,,,,,,,,,,,,,"Indonesian, English, Hausa, Arabic",1,,,,,,1,,,,,Geopolitical interests,,,1,,,,,,,,"Facebook said, “The administrators and account owners represented themselves as locals and made-up media entities, often using fake accounts — and they impersonated real political groups and media organizations. They posted news stories on current events and frequently repurposed and amplified content from Iranian state media""",,1,,1,,,Establishing a media presence that is sympathetic to Iranian interests,Iran,,,Iranian state messaging often directly reproduced on social media and linked websites.,,1,,,,,,,,,-0.93,2015,-0.81,2016,-0.93,2017,,,-0.2,2016,-1.51,2015,-1.34,2016,-1.3,2017,87,2015,87,2016,85,2017,,,,,,,,,,,,,,,,,To establish a media presence abroad that is sympathetic to Iranian interests,1,1,,,,
13,Venezuela >>> Venezuela 2014,A state-backed influence operation promoted the Maduro regime and made use of bespoke automation tools to spread messaging that was sympathetic to Venezuelan state interests.,2014,,,2019,January,Clearly stated campaign ended within time frame,2019,March,"#TrollTracker: Venezuelan Government-linked Influence Campaign on Twitter. Medium. DFRLab, March 13, 2019. https://medium.com/dfrlab/trolltracker-venezuelan-government-linked-influence-campaign-on-twitter-63a8fe7a62e0",https://medium.com/dfrlab/trolltracker-venezuelan-government-linked-influence-campaign-on-twitter-63a8fe7a62e0,,,,Venezuela,,,,,,,,,,1,,,,-1.08,2013,-0.85,2014,-0.98,2015,,,No Data,No Data,-0.95,2013,-1.08,2014,-1.09,2015,53,2013,56,2014,57,2015,,,,,,,new government attempt.,"Relevant protests: In the first quarter of 2014, a series of protests took place to draw attention to the Venezuela’s high levels of urban violence, rampant economic inflation, and chronic shortages of basic goods; Twitter accounts were then made on this date. On March 14, 2016, tens of thousands of pro-Maduro demonstrators gathered in the streets to protest U.S. sanctions, opposed by anti-Maduro activists. @DFRLab determined that at least 91 accounts were created that same day. On January 20, 2017, there was a noticeable increase in account creation activity after protests broke out when multiple opposition leaders were arrested following the collapse of a planned dialogue with the Maduro government.",,,,referenced influence abroad but did not specify,,,,,1,,,,,1,,,,,,,,,,,,,,,,"RTNicolasMaduro, an app directly linked to Nicolas Maduro and the United Socialist Party of Venezuela (PSUV) that can be used to retweet Maduro. It was used in 4000 tweets.","Twitter removed 1196 accounts associated with this domestic state-backed influence campaign.The operation primarily used government-linked propaganda hashtags such as #LegionFANB, which expressed support for the National Bolivarian Armed Forces of Venezuela, and #Tropa, a hashtag commonly used by regime supporters on Twitter to identify themselves. An app was used -- RTNicolasMaduro -- to retweet Maduro's tweets, and was used in 4000 tweets. Additionally, out of the top 10 hashtag combinations used, two in particular — #RT #Noticias and #Noticias #RT — often accompanied stories from Russia Today (hence the coding of state media).",Spanish,1,,1,1,,,,,,,,,,1,,1,,,,,,,,1,,,,,,,Venezuela,,,,1,,1,,,,,,,,No Data,No Data,-0.85,2014,-0.98,2015,,,No Data,No Data,-0.95,2013,-1.08,2014,-1.09,2015,53,2013,56,2014,57,2015,,,,,,,new government attempt.,"Relevant protests: In the first quarter of 2014, a series of protests took place to draw attention to the Venezuela’s high levels of urban violence, rampant economic inflation, and chronic shortages of basic goods; Twitter accounts were then made on this date. On March 14, 2016, tens of thousands of pro-Maduro demonstrators gathered in the streets to protest U.S. sanctions, opposed by anti-Maduro activists. @DFRLab determined that at least 91 accounts were created that same day. On January 20, 2017, there was a noticeable increase in account creation activity after protests broke out when multiple opposition leaders were arrested following the collapse of a planned dialogue with the Maduro government.",,,,,,,,,To support the incumbent Moduro and change opinions about the regime among the Venezuelan electorate and abroad.,1,1,,,,
14,United Kingdom >>> ---,Facebook assets engaged in coordinated inauthentic behavior to propagate pro-Islam and anti-extremist messaging in the United Kingdom.,,,,2019,March,Clearly stated campaign ended within time frame,2019,March,"#TrollTracker: Facebook Takes Down Fake Network in the United Kingdom. Medium. DFRLab, March 7, 2019. https://medium.com/dfrlab/exclusive-facebook-takes-down-fake-network-in-the-united-kingdom-58350e0f3401",https://medium.com/dfrlab/exclusive-facebook-takes-down-fake-network-in-the-united-kingdom-58350e0f3401,,,,United Kingdom,,,,,,,,,1,,,anti-Islam users,Influential Individual = Tommy Robinson (former leader of  the far-right extremist group English Defense League.),No Data,No Data,No Data,No Data,No Data,No Data,,,No Data,No Data,No Data,No Data,No Data,No Data,No Data,No Data,No Data,No Data,No Data,No Data,No Data,No Data,,1,,,,,,,,,,,,,,,,,1,1,1,,,,,,,,,,,,,,,,,,"On March 7, Facebook removed 23 pages, 74 Facebook accounts, five groups, and 35 Instagram accounts that the company assessed to be “engaging in coordinated inauthentic behavior as part of a domestic-focused network in the UK.” These pages had approximately 175,000 followers, and approximately 4,500 accounts followed at least one of the removed Instagram accounts.Facebook determined that individuals behind the accounts violated the platform’s ban on “coordinated inauthentic behavior” by running a network relying on “fake accounts to misrepresent themselves.”",English,,,,,,,1,1,1,,,,,,1,,,,,,,,,,,,1,,,,,,,"No attribution given in the text, although the Facebook assets had ties to Pakistan. Given the United Kingdom's long-established Pakistani community, it is unclear whether the campaign was run by people based in the UK or based in Pakistan.",,,,,,,,,,,No Data,No Data,No Data,No Data,No Data,No Data,,,No Data,No Data,No Data,No Data,No Data,No Data,No Data,No Data,No Data,No Data,No Data,No Data,No Data,No Data,,,,,,,,,,,,,,,,,To promote Anti-Islamophobic and Anti-extremist narratives. In some cases trolling UK far-right Facebook with a honeypot conservative community/group only to switch messaging to pro-Islam and pro-Pakistan.,,1,,,,
15,Romania >>> Romania 2018,"Facebook assets spread highly biased political messaging in favor of Romania’s ruling Social Democratic Party (PSD), and denigrated opposing politicians.",2018,,,2019,March,Clearly stated campaign ended within time frame,2019,March,"#TrollTracker: Facebook Takes Down Fake Network in Romania. Medium. DFRLab, March 7, 2019. https://medium.com/dfrlab/exclusive-facebook-takes-down-fake-network-in-romania-20c33591b4ea",https://medium.com/dfrlab/exclusive-facebook-takes-down-fake-network-in-romania-20c33591b4ea,,,,Romania,,,,,,,,,,1,,,,0.06,2017,0.06,2018,No Data,No Data,,,No Data,No Data,0.52,2017,No Data,No Data,No Data,No Data,No Data,No Data,No Data,No Data,No Data,No Data,,,,,1,,EU-Romania relations,"Federal Election: Romanian President Klaus Iohannis is up for re-election in the upcoming November 2019 presidential elections. Other - EU-Romania relations: In 2019, Romania took over the EU’s rotating Presidency of the Council of the European Union, a position it held until June 30, 2019. Additionally, the EU accused the Romanian government of stalling its efforts to combat corruption. An EU communique urged the country to reform its judicial system and appoint a new anti-corruption prosecutor. Romania’s former chief anti-corruption prosecutor, Laura Codru?a Kövesi, spearheaded various anti-corruption initiatives that jailed prominent former politicians, including high-ranking PSD members. She was later dismissed from her post.",,,,,,,,,,,1,1,,,,,,,,,,,,,,,,,,,"On March 7, 2019, Facebook removed a network of four Romanian Facebook pages, 26 Facebook accounts, and a public Facebook group. At least four of the Facebook pages linked to affiliate news sites that produced highly biased content.","Romanian, English",1,,1,1,,,,,,,,,,1,,,,,,,,,,1,,,1,,,,Romania,,,,,1,,,,,,,,,0.06,2017,0.06,2018,No Data,No Data,,,No Data,No Data,0.52,2017,No Data,No Data,No Data,No Data,No Data,No Data,No Data,No Data,No Data,No Data,,,,,1,,,,,,,,,,,,To support the image of the ruling PSD party in Romania by promoting its incumbent members and attacking its rivals.,1,,,,,
16,United States >>> --- 2019,"Thousands of accounts spammed U.S. Secretary of State Mike Pompeo’s Instagram account by posting duplicate and often pro-Iran, anti-U.S. comments. Some accounts also advocated for Iranian opposition movements.",2019,January,Clearly stated campaign start within time frame,,,,2019,February,"#TrollTracker: Spam Attack on Secretary Pompeo. Medium. DFRLab, February 25, 2019. https://medium.com/dfrlab/trolltracker-spam-attack-on-secretary-pompeo-d2ab638f0b5",https://medium.com/dfrlab/trolltracker-spam-attack-on-secretary-pompeo-d2ab638f0b5e,,,,United States,,,,1,,,,,,,,,Government - Civilian = US Secretary of State Mike Pompeo,0.48,2018,No Data,No Data,No Data,No Data,,,No Data,No Data,No Data,No Data,No Data,No Data,No Data,No Data,22,2018,No Data,No Data,No Data,No Data,,1,,,,,January 11 Americans announced Warsaw Conference; February 13-14 2019 Warsaw Conference,"American Secretary of State Mike Pompeo announced an international summit on Middle East security and Iran’s threat to stability in the region on January 11, 2019. The summit, called the Warsaw Conference, was in Poland from February 13-14, 2019.",,,,,,,,,,,,,1,1,,,,,,,,,,,,,,,,,"Instagram was the primary platform; Instagram accounts spammed US Secretary of State's Instagram posts, predominantly with pro-Iran messaging (although some of the accounts advocated for Iranian opposition movements.) Some amplified hashtags were seen on Twitter as well, but the main hashtag -- #InviteRestartLeadersToWarsaw -- is supportive of an Iranian opposition movement.",English,1,,,,,,,,,,,Geopolitical issues,,,,1,,,,,,,,,,,,,1,,,,,,,,,,,,,,,,No Data,No Data,No Data,No Data,No Data,No Data,,,No Data,No Data,No Data,No Data,No Data,No Data,No Data,No Data,No Data,No Data,No Data,No Data,No Data,No Data,,,,,,,January 11 Americans announced Warsaw Conference; February 13-14 2019 Warsaw Conference,"American Secretary of State Mike Pompeo announced an international summit on Middle East security and Iran’s threat to stability in the region on January 11, 2019. The summit, called the Warsaw Conference, was in Poland from February 13-14, 2019. Iran’s Foreign Minister Mohammad Javad Zarif criticized Poland for jointly hosting the summit with the United States, calling it a “desperate anti-Iran circus.”",,,,,,,,,"To spam Secretary of State Mike Pompeo, spread anti-American sentiment, and encourage President Donald Trump to invite Iran's Prince Reza Pahlavi to the Warsaw Summit.",1,,,,,
17,Ukraine >>> Russia,24 Instagram pages masqueraded as news aggregators in central and western Ukraine.,,,,2019,January,Clearly stated campaign ended within time frame,2019,February,"#ElectionWatch: Insta-Deception Targets Ukraine. Medium. DFRLab, February 19, 2019. https://medium.com/dfrlab/electionwatch-insta-deception-targets-ukraine-6f4a820bace0",https://medium.com/dfrlab/electionwatch-insta-deception-targets-ukraine-6f4a820bace0,,,,Ukraine,,,Central and Western Ukraine,,,,,,,1,,,"The 24 Instagrams posted as local news aggregators in different Ukrainian districts, particularly targeting central and western Ukraine.",No Data,No Data,No Data,No Data,No Data,No Data,,,No Data,No Data,No Data,No Data,No Data,No Data,No Data,No Data,No Data,No Data,No Data,No Data,No Data,No Data,,,1,,1,,Federal Election (binary),Intra-state war = War in Donbass,,,,,,,,,,,1,1,1,,,,,,,,,,,,,,,,,,"24 Instagram pages taken down by the platform posted more than 24,000 posts and accumulated nearly 80,000 followers.","Ukrainian, Russian",1,1,1,1,,,,,,,,,,,1,,,,,,,,"Not all engagement appears to have been organic. A closer investigation of the accounts revealed that some of the users engaging with the Today Network’s content were Turkish, not Ukrainian. It suggests that the engagement may not have been organic and the network used artificial amplification to build up an audience.",,1,,,,,,Russia,,,"Facebook said that the accounts ""shared characteristics"" with Internet Research Agency (IRA) operations. The IRA is linked to the Kremlin. There is not other evidence of attribution to the IRA.",,1,,,,,,,,,No Data,No Data,No Data,No Data,No Data,No Data,,,No Data,No Data,No Data,No Data,No Data,No Data,No Data,No Data,No Data,No Data,No Data,No Data,No Data,No Data,,1,,,,,,Extra-state war = Ukraine intervention,,,,,,,,,"Expand Russian information campaign operations into more central and western parts of Ukraine, targeting the March 2019 Presidential Election.",1,,,,,
18,Venezuela >>> Venezuela 2018,"A campaign by the Venezuelan government provided civilians with financial incentives to engage in inorganic behavior online, spreading state propaganda under the guise of ""defending truth.""",2018,December,,,,,2019,February,"#InfluenceForSale: Venezuela’s Twitter Propaganda Mill. Medium. DFRLab, February 3, 2019. https://medium.com/dfrlab/influenceforsale-venezuelas-twitter-propaganda-mill-cd20ee4b33d8",https://medium.com/dfrlab/influenceforsale-venezuelas-twitter-propaganda-mill-cd20ee4b33d8,,,,Venezuela,,,,,,,,,,1,,,,-1.25,2017,-1.34,2018,No Data,No Data,,,No Data,No Data,-1.21,2017,No Data,No Data,No Data,No Data,63,2017,66,2018,No Data,No Data,,,,,,,new government attempt,,,,,,,,,,,,,,,1,,,,,,,,1,,,,,,,,"One account rewards people who tweet using the designated hashtags with money through an app called VeMonedero, a digital wallet where the government deposits aid money to an account tied to Venezuelan people’s Carnet de la Patria (Motherland Card), an ID card that identifies social aid recipients. In order to receive money for tweeting, people register their Twitter accounts in the app and tweet the hashtags.  Some of the hashtags are also pushed on state media television programs.",A Telegram channel acts like a direct feed bot to one account's Twitter activity.,Spanish,1,,1,,,,,,,,1,,,1,,,,,,,,,"Accounts demonstrated bot-like behavior but at a lower score than usual, only so much as to infer partial automation",1,1,,,,,,Venezuela,,,,1,,,,,,,,,,-1.28,2017,-1.34,2018,No Data,No Data,,,No Data,No Data,-1.21,2017,No Data,No Data,No Data,No Data,63,2017,66,2018,No Data,No Data,,,,,,,new government attempt,,,,,,,,,,"Boost the Maduro government on Twitter, building the facade of popular support online.",1,1,,,,
19,Middle East >>> Iran 2010,Facebook identified a network of pages originating from Iran targeting more than a dozen countries in eight languages. 783 Facebook assets were taken down for coordinated inauthentic behavior.,2010,,Clearly stated campaign start within time frame,2019,January,Clearly stated campaign ended within time frame,2019,January,"#TrollTracker: Outward Influence Operation From Iran. Medium. DFRLab, January 31, 2019. https://medium.com/dfrlab/trolltracker-outward-influence-operation-from-iran-cc4539684c8d",https://medium.com/dfrlab/trolltracker-outward-influence-operation-from-iran-cc4539684c8d,,,,,Middle East,,"While the campaign spanned regions and continents, the Middle East was one main target. The majority of Facebook pages were published in Arabic.",,,,,,,,,,,No Data,No Data,No Data,No Data,No Data,No Data,,,No Data,No Data,No Data,No Data,No Data,No Data,No Data,No Data,No Data,No Data,No Data,No Data,No Data,No Data,,,,,,,unofficial Arab-Israeli pact against Iran,,,North America,,"While the campaign spanned regions and continents, some pages were targeted at North America, particularly the US.",,North Africa,,"While the campaign spanned regions and continents, some pages were targeted at North Africa in particular.",,,1,1,,,,,,,,,,,,,,,,,,,"Some Facebook assets linked to websites sharing biased content. 97 pages were created between 2010 and 2018, and at least 38 pages were active for more than five years. In total, the pages amassed nearly 2.5 million followers, of which 1.95 million were not duplicated. Facebook removed 783 assets in total.","Arabic, English, French, Hebrew, Persian, Spanish, Hindi, Indonesian",1,1,,,1,,1,1,1,1,,9/11 conspiracies,,,1,,,,,,1,,"Apart from images and memes, a page called @StopMEK shared a link to an archived ""unclassified"" governmental report on how the United States was monitoring the MEK’s movement in Iran in the mid-1990’s. The file was embedded as a QR code on one of the page’s images. Unclear if the document was faked or not.",1,,,1,,,,Iran,,,Facebook assessed that the campaign was associated with Iran.,,1,,,,,,,,,-1.56,2009,-1.63,2010,-1.42,2011,,,1.9,2010,-1.58,2009,-1.61,2010,-1.58,2011,No Data,No Data,No Data,No Data,89,2011,,,,,,,,,,,,,,,,,"Spread anti-Israeli, anti-US, and generally anti-Western narratives and messaging that aligns with Iranian interests regionally and abroad.",,1,,,,
20,Mexico >>>   2018,"Inauthentic activity originating from South Asian Facebook accounts artificially inflated the number of Facebook “likes” on social media content for and about the state government of Oaxaca in Mexico. The main beneficiary of the activity was Alejandro Murat Hinojosa, the governor of the state of Oaxaca.",2018,May,,,,,2019,January,"#ElectionWatch: Likes from Afar in Oaxaca. Medium. DFRLab, January 17, 2019. https://medium.com/dfrlab/electionwatch-likes-from-afar-in-oaxaca-b7c7d5fcedf6",https://medium.com/dfrlab/electionwatch-likes-from-afar-in-oaxaca-b7c7d5fcedf6,,,,Mexico,,,,,,,,,,1,,,,-0.72,2017,-0.57,2018,No Data,No Data,,,No Data,No Data,-0.08,2017,No Data,No Data,No Data,No Data,39,2017,40,2018,No Data,No Data,,,,,,,,No concurrent events indicates change as inauthentic activity happens outside of election cycle.,,,,,,,,,,,,1,,,,,,,,,,,,,,,,,,,"Fake likes appear on Facebook pages for the Government of the State of Oaxaca, including the governor's page and his wife's page.",,1,,,,,,,,,,,,,,,,,,,,,Faked likes,,,1,,,,,,,,,,,,,,,,,,,,No Data,No Data,No Data,No Data,No Data,No Data,,,No Data,No Data,No Data,No Data,No Data,No Data,No Data,No Data,No Data,No Data,No Data,No Data,No Data,No Data,,,,,,,,,,,,"Suspected ""likes-for-hire"" style engagement.",,,,,"Create a base of engagement in Spanish speaking and Mexican spheres online, likely to set a precedent for later activation come time for election interference.",1,,,,,
21,Baltic States >>> Russia 2010,"Around 300 Facebook pages masqueraded as groups with special interests — ranging from food to support for authoritarian presidents — and amplified content from the Kremlin’s media agency, Rossiya Segodnya. It appears to be a systematic and covert attempt to build Rossiya Segodnya's online audience in over a dozen countries. Sputnik, an outlet in Rossiya Segodnya's portfolio, was particularly boosted in this campaign.
",2010,,Clearly stated campaign start within time frame,2019,January,Clearly stated campaign ended within time frame,2019,January,"Facebook’s Sputnik Takedown — In Depth. Medium. DFRLab, January 17, 2019. https://medium.com/dfrlab/facebooks-sputnik-takedown-in-depth-f417bed5b2f8",https://medium.com/dfrlab/facebooks-sputnik-takedown-in-depth-f417bed5b2f8,,,"Most common page creation dates were October 2017 and November - October 2018. Some pages had been abandoned by 2018, while others were still active before the Facebook takedown.",,Baltic States,,"The campaign spanned countries, but the Baltic States -- Estonia, Latvia, and Lithuania -- were explicitly targeted. While not in the Baltic States, Belarus, a neighboring country, was also explicitly targeted.",,,,,,,1,,,,No Data,No Data,No Data,No Data,No Data,No Data,,,No Data,No Data,No Data,No Data,No Data,No Data,No Data,No Data,No Data,No Data,No Data,No Data,No Data,No Data,,,,,,,,,,Central Asia,,"The campaign spanned countries. Certain states in Central Asia were particularly targeted, including  Kyrgyzstan, Tajikistan, Uzbekistan, and Kazakhstan.",,Caucasus,,"The campaign spanned countries, but the Caucasus -- specifically, Armenia, Georgia, and Chechnya -- were explicitly targeted. While not in the Caucasus, Moldova was also targeted.",1,,,1,,,,,,,,,,,,,,,,,,TOK,"Some of the Facebook assets linked to Sputnik, a Russian state media outlet. Many of the pages cross-posted videos from Sputnik and from TOK (a video service that is also part of Rossiya Segodnya's portfolio).
",Russian,1,,,,,,,1,,,,Geopolitical interests; random content.,,,1,,,,,,,,,,,,,,1,Saturating the information space,Russia,,,"In the case of Latvia, Facebook concluded that the Facebook assets were linked to Sputnik employees.",1,1,,,,,,,,,-0.97,2009,-0.93,2010,-1,2011,,,23.5,2010,-0.9,2009,-0.89,2010,-0.88,2011,No Data,No Data,No Data,No Data,52,2011,,1,,,,,,,,,,,,,,,To increase the reach of Rossiya Segodnya across countries by building audiences based on specific interests.,,1,,,,
22,Italy >>> Italy 2014,Civilian and corporate Twitter accounts were registered for a service hosted on Italian politician Matteo Salvini's personal website which allowed the accounts to partially be used as bots in a larger network. The dormant network was activated in the time leading up to Italy's March 2018 federal election.,2014,,Clearly stated campaign start within time frame,,,,2018,January,"#ElectionWatch: Italy’s Self-Made Bots. Medium. DFRLab, January 25, 2018. https://medium.com/dfrlab/electionwatch-italys-self-made-bots-200e2e268d0e",https://medium.com/dfrlab/electionwatch-italys-self-made-bots-200e2e268d0e,,https://www.davidpuente.it/blog/2018/01/24/tweet-automatici-della-lega-nord-su-twitter-un-matteo-salvini-strepitoso-su-la7-siete-daccordo/,Start Year = mentioned in accompanying link 2 stating that the registration page was available in 2014,Italy,,,,,,,,,,1,,,,0.5,2013,0.46,2014,0.38,2015,,,22.9,2014,0.95,2013,1,2014,1.03,2015,23,2013,22,2014,23,2015,,,,,1,,,Federal Election = March 2018 Italian National Election,,,,,,,,,,,,,,1,,,,,,,,,,,,,,,,Twitter accounts activated by a subscription service that operated the accounts as a botnet.,An app that Twitter users sign up for that automatically sends tweets from their accounts.,Italian,,,1,,,,,,,,,,,1,,1,,,,,,An app that Twitter users sign up for that automatically sends tweets from their accounts.,Brigading because inauthentic activity was executed under the users' real names,,1,,,,,,Italy,,,,,,1,,,,,,,,0.5,2013,0.46,2014,0.38,2015,,,22.9,2014,0.95,2013,1,2014,1.03,2015,23,2013,22,2014,23,2015,,,,,1,,,"Federal Election = March 2018 national elections in Italy
",,,,,,,,,To amplify the Lega party on Twitter.,1,,,,,
