Serial_Number,Campaign_ID,Long_Description,Date_Start_Year,Date_Start_Month,Date_Start_Certainty,Date_End_Year,Date_End_Month,Date_End_Certainty,Year_of_Report,Month_of_Report,Citation_1,Link_1,Citation_2,Link_2,Meta_Notes,Primary_Target_Nation_of_Origin,Primary_Target_Regional_Bloc,Primary_Target_Other,Primary_Target_Notes,Target_Category_Government_Civilian,Target_Category_Government_Military,Target_Category_Political_Party,Target_Category_NonState_Political_Actor,Target_Category_Business,Target_Category_Influential_Individuals,Target_Category_Electorate,Target_Category_Racial_Ethnic_Religious_Sexual_Identity_Group,Target_Category_Other,Target_Category_Notes,Target_Political_Stability_Year_Prior,Target_Political_Stability_Year_Prior_Data_Year,Target_Political_Stability,Target_Political_Stability_Data_Year,Target_Political_Stability_Year_After,Target_Political_Stability_Year_After_Data_Year,Target_Conflict_Deaths,Target_Conflict_Deaths_Data_Year,Target_Refugee_Stock,Target_Refugee_Stock_Data_Years,Target_Voice_and_Accountability_Year_Prior,Target_Voice_and_Accountability_Year_Prior_Data_Year,Target_Voice_and_Accountability,Target_Voice_and_Accountability_Data_Year,Target_Voice_and_Accountability_Year_After,Target_Voice_and_Accountability_Year_After_Data_Year,Target_Internet_Freedom_Year_Prior,Target_Internet_Freedom_Year_Prior_Data_Year,Target_Internet_Freedom,Target_Internet_Freedom_Data_Year,Target_Internet_Freedom_Year_After,Target_Internet_Freedom_Year_After_Data_Year,Target_Concurrent_Events_Interstate_War,Target_Concurrent_Events_Extrastate_War,Target_Concurrent_Events_IntraState_War,Target_Concurrent_Events_NonState_War,Target_Concurrent_Events_Federal_Election,Target_Concurrent_Events_State_Election,Target_Concurrent_Events_Other,Target_Concurrent_Events_Notes,Secondary_Target_Nation_of_Origin,Secondary_Target_Regional_Bloc,Secondary_Target_Other,Secondary_Target_Notes,Tertiary_Target_Nation_of_Origin,Tertiary_Target_Regional_Bloc,Tertiary_Target_Other,Tertiary_Target_Notes,Platforms_Open_Web_State_Media,Platforms_Open_Web_Independent_Media,Platforms_Open_Web_Junk_News_Website,Platforms_Social_Media_Facebook,Platforms_Social_Media_Instagram,Platforms_Social_Media_Twitter,Platforms_Social_Media_Youtube,Platforms_Social_Media_LinkedIn,Platforms_Social_Media_Reddit,Platforms_Social_Media_VK,Platforms_Social_Media_Forum_Board,Platforms_Social_Media_Other,Platforms_Messaging_Platforms_WhatsApp,Platforms_Messaging_Platforms_Telegram,Platforms_Messaging_Platforms_Signal,Platforms_Messaging_Platforms_Line,Platforms_Messaging_Platforms_WeChat,Platforms_Messaging_Platforms_SMS,Platforms_Messaging_Platforms_SMS,Platforms_Advertisement,Platforms_Email,Platforms_Other,Platforms_Notes,Content_Language,Content_Topics_Government,Content_Topics_Military,Content_Topics_Political_Party,Content_Topics_Elections,Content_Topics_NonState_Political_Actor,Content_Topics_Business,Content_Topics_Influential_Individual,Content_Topics_Racial_Ethnic_Religious_Sexual_Identity_Group,Content_Topics_Terrorism,Content_Topics_Immigration,Content_Topics_Economic_Issues,Content_Topics_Other,Content_Notes,Methods_Tactics_Brigading,Methods_Tactics_Sockpuppets,Methods_Tactics_Botnets,Methods_Tactics_Search_Engine_Manipulation,Methods_Tactics_Hacking_Ddos,Methods_Tactics_Hacking_Data_Exfiltration,Methods_Tactics_Deceptive_Content_Manipulation_Deep_Learning_Processes,Methods_Tactics_Deceptive_Content_Manipulation_Other,Methods_Tactics_Other,Methods_Tactics_Notes,Methods_Narrative_Techniques_Constructive_Activate,Methods_Narrative_Techniques_Constructive_Astroturf,Methods_Narrative_Techniques_Destructive_Suppress,Methods_Narrative_Techniques_Destructive_Discredit,Methods_Narrative_Techniques_Oblique_Troll,Methods_Narrative_Techniques_Oblique_Flood,Methods_Narrative_Techniques_Notes,Primary_Disinformant_Nation_of_Origin,Primary_Disinformant_Regional_Bloc,Primary_Disinformant_Other,Primary_Disinformant_Notes,Disinformant_Category_Government_Direct_Attribution,Disinformant_Category_Government_Proxy_Inferred_Attribution,Disinformant_Category_Political_Party,Disinformant_Category_NonState_Political_Actor,Disinformant_Category_Business,Disinformant_Category_Influential_Individual,Disinformant_Category_Electorate,Disinformant_Category_Racial_Ethnic_Religious_Sexual_Identity_Group,Disinformant_Category_Other,Disinformant_Category_Notes,Disinformant_Political_Stability_Year_Prior,Disinformant_Political_Stability_Year_Prior_Data_Year,Disinformant_Political_Stability,Disinformant_Political_Stability_Data_Year,Disinformant_Political_Stability_Year_After,Disinformant_Political_Stability_Year_After_Data_Year,Disinformant_Conflict_Deaths,Disinformant_Conflict_Deaths_Data_Year,Disinformant_Refugee_Stock,Disinformant_Refugee_Stock_Data_Years,Disinformant_Voice_and_Accountability_Year_Prior,Disinformant_Voice_and_Accountability_Year_Prior_Data_Year,Disinformant_Voice_and_Accountability,Disinformant_Voice_and_Accountability_Data_Year,Disinformant_Voice_and_Accountability_Year_After,Disinformant_Voice_and_Accountability_Year_After_Data_Year,Disinformant_Internet_Freedom_Year_Prior,Disinformant_Internet_Freedom_Year_Prior_Data_Year,Disinformant_Internet_Freedom,Disinformant_Internet_Freedom_Data_Year,Disinformant_Internet_Freedom_Year_After,Disinformant_Internet_Freedom_Year_After_Data_Year,Disinformant_Concurrent_Events_Interstate_War,Disinformant_Concurrent_Events_Extrastate_War,Disinformant_Concurrent_Events_IntraState_War,Disinformant_Concurrent_Events_NonState_War,Disinformant_Concurrent_Events_Federal_Election,Disinformant_Concurrent_Events_State_Election,Disinformant_Concurrent_Events_Other,Disinformant_Concurrent_Events_Notes,Secondary_Disinformant_Nation_of_Origin,Secondary_Disinformant_Regional_Bloc,Secondary_Disinformant_Other,Secondary_Disinformant_Notes,Tertiary_Disinformant_Nation_of_Origin,Tertiary_Disinformant_Regional_Bloc,Tertiary_Disinformant_Other,Tertiary_Disinformant_Notes,Intent_Objective,Intent_Category_Civil,Intent_Category_Social,Intent_Category_Economic,Intent_Category_Military,Intent_Notes,
1,Hong Kong >>> China 2019,"In order to obstruct discourse about the Hong Kong protests and sow discord, a network consisting of approximately 200,000 accounts took aim at pro-democracy protesters in Hong Kong via commerical spam and political tweets.",2019,June,Clearly stated campaign start within time frame,2019,August,Clearly stated campaign ended within time frame,2019,September,"“Twitter's Hong Kong Archives: Chinese Commercial Bots at Work.” Medium. DFRLab, September 4, 2019. https://medium.com/dfrlab/twitters-hong-kong-archives-chinese-commercial-bots-at-work-f4c7ae8eea64.",https://medium.com/dfrlab/twitters-hong-kong-archives-chinese-commercial-bots-at-work-f4c7ae8eea64,,,,Hong Kong,,,Hong Kong is a Chinese territory,,,,,,1,1,,,Influential Individuals are Hong Kong protesters and activists. Electorate is Hong Kong natives.,1,2018,No Data,No Data,No Data,No Data,,,No Data,No Data,No Data,No Data,No Data,No Data,No Data,No Data,No Data,No Data,No Data,No Data,No Data,No Data,,,,,,,Catalyst of protests was an extradition bill that was going to be voted on in Hong Kong's legislature.,,,,,,,,,,,,,,,1,1,,,,,Sina Weibo / Tencent / Sohu / NetEase / Fanwei,,,,,,,,,,,"A network of 200,000 Twitter accounts was suspended. 936 of the accounts were analyzed by the DFRLab. Some of the Twitter accounts used VPNs, while others were from specific unblocked IP addresses in mainland China. Some of the Twitter accounts used Chinese applications including FaWave, Yibo Android, and Sina Weibo.","Cantonese, Chinese, Indonesian, Arabic, English, Spanish",1,,,,,,1,,,,,Hong Kong extradition bill,,,,1,,,,,,,,,,,1,,,,China,,,,,1,,,,,,,,,-0.26,2018,No Data,No Data,No Data,No Data,,,No Data,No Data,No Data,No Data,No Data,No Data,No Data,No Data,88,2018,No Data,No Data,No Data,No Data,,,,,,,talyst of protests was an extradition bill that was going to be voted on in Hong Kong's legislature.,,,,,,,,,,To obstruct discourse about the Hong Kong protests and sew discord. Target individuals speaking out about mainland China.,1,1,,,,
2,Spain >>> --- 2018,The Catalan independence movement was artificially amplified through the use 130+ Twitter accounts.,2018,December,Clearly stated campaign start within time frame,2019,June,Clearly stated campaign ended within time frame,2019,August,"“Catalonia Twitter Takedown: Inorganic Campaign Pushed Pro-Independence Content.” Medium. DFRLab, August 9, 2019. https://medium.com/dfrlab/catalonia-twitter-takedown-inorganic-campaign-pushed-pro-independence-content-fe9ee0e44f3c.",https://medium.com/dfrlab/catalonia-twitter-takedown-inorganic-campaign-pushed-pro-independence-content-fe9ee0e44f3c,,,,Spain,,,"Catalonia is a state within Spain, although it is highly contested.",,,1,1,,,1,,,Nonstate Political Actor is Catalan independence movement.,0.28,2017,0.25,2018,No Data,No Data,,,No Data,No Data,1.03,2017,No Data,No Data,No Data,No Data,No Data,No Data,No Data,No Data,No Data,No Data,,,,,1,,Catalan Independence Referendum,"Catalan Parliament declared independence from Spain in October 2017 following the referendum; September 11 anniversary of the 1714 siege of Barcelona; imprisonment of two Catalan pro-independence leaders (Jordi Cuixart and Jordi Sanchez) on October 16, 2017 on sedition charges.",,,,,,,,,,,,,,1,,,,,,Third party twitter apps were used,,,,,,,,,,A website was dedicated to one of the amplified Catalan independence hashtags (#FemXarxa).,"The most amplified hashtag pushing Catalan independence, #FemXarxa, received ~7,500 retweets. The second most amplified hashtag was #11S. The third most amplified hashtag was #USVolemACasa, demanding the release of two Catalan pro-independence leaders.","Catalan, Spanish, English, Portuguese",1,,1,,1,,1,,,,,,,1,1,,,,,,,,Some automation for retweets using Botize and IFTTT though negligible,1,1,,,,,,,,,,,,,,,,,,,,No Data,No Data,No Data,No Data,No Data,No Data,,,No Data,No Data,No Data,No Data,No Data,No Data,No Data,No Data,No Data,No Data,No Data,No Data,No Data,No Data,,,,,,,,,Russia,,,,Venezuala,,,Venezuala-adjacent accounts; no affirmative state attribution.,The goal was to amplify pro-Catalan independence messaging in Spain.,1,1,,,,
3,Turkey >>> Saudi Arabia 2017,"A Saudi-associated network of Facebook, Instagram, and web assets promoted Saudi geopolitical interests while pushing content against Turkey, Iran, and Qatar.",2017,January,,2019,August,Clearly stated campaign ended within time frame,2019,August,"“Royally Removed: Facebook Takes Down Pages Promoting Saudi Interests.” Medium. DFRLab, August 14, 2019. https://medium.com/dfrlab/royally-removed-facebook-takes-down-pages-promoting-saudi-interests-edc0ce8b972a.",https://medium.com/dfrlab/royally-removed-facebook-takes-down-pages-promoting-saudi-interests-edc0ce8b972a,,https://newsroom.fb.com/news/2019/08/cib-uae-egypt-saudi-arabia/,,Turkey,,,Specifically content undermining Turkish President Recep Tayyip Erdo?an,1,,,,,,,,,Government - Civilian = Royal Family.,-2.01,2016,-1.79,2017,-1.33,2018,,,6.2,2017,-0.61,2016,-0.71,2017,No Data,No Data,61,2016,66,2017,66,2018,,,,,1,,Erdo?an wrote an op-ed decrying death of Khashoggi.,Federal Election = the 2018 Turkish presidential elections occurred in the time frame of this campaign.,Qatar,,,"Specifically, Hamad bin Khalifa Al Thani, the former Emir of Qatar",Iran,,,,,,1,1,1,1,,1,,,,Pinterest,,,,,,,,1,,,387 Assets,"Arabic, English",1,1,,,,,,,,,,,,,1,,,,,,,,,,1,,1,,,"Constructive for pro-Saudi narrative; destructive for anti-Qatar, Turkey, and Iran narratives.",Saudi Arabia,,,,,1,,,,,,,,,-0.46,2016,-0.58,2017,-0.52,2018,,,2.5,2017,-1.73,2016,-1.68,2017,No Data,No Data,72,2016,72,2017,73,2018,,1,,,,,,Extra-state war = Yemen,,,,,,,,,"Promote anti-Turkey, Qatar, and Iran narratives while pushing pro-Saudi interests.",1,,,1,,
4,Colombia >>> --- 2019,A group of accounts that exhibited bot-like behavior amplified three pro-government hashtags in Colombia between May and July 2019.,2019,May,Clearly stated campaign start within time frame,2019,July,Clearly stated campaign ended within time frame,2019,August,"Bot-Like Accounts and Pro-Government Hashtags in Colombia. Medium. DFRLab, August 29, 2019. https://medium.com/dfrlab/bot-like-accounts-and-pro-government-hashtags-in-colombia-35609a5b62f1",https://medium.com/dfrlab/bot-like-accounts-and-pro-government-hashtags-in-colombia-35609a5b62f1,,,,Colombia,,,,,,,,,,1,,,,-0.81,2018,No Data,No Data,No Data,No Data,,,No Data,No Data,No Data,No Data,No Data,No Data,No Data,No Data,31,2018,No Data,No Data,No Data,No Data,,,,,,,The extradition of former Minister of Agriculture and Rural Development Andrés Felipe Arias,,,,,,,,,,,,,,,1,,,,,,,,,,,,,,,,,Three hashtags amplified by bot-like accounts.,Spanish,1,1,,,,,1,,,,,,,,,1,,,,,,,,,1,,,,,,,,,,,,,,,,,,,,No Data,No Data,No Data,No Data,No Data,No Data,,,No Data,No Data,No Data,No Data,No Data,No Data,No Data,No Data,No Data,No Data,No Data,No Data,No Data,No Data,,,,,,,The extradition of former Minister of Agriculture and Rural Development Andrés Felipe Arias,,,,,,,,,,To make it appear that Colombian state interests were broadly supported on Twitter,1,,,,,
5,Georgia >>> --- 2019,"Georgian Facebook pages spread coordinated narratives to discredit Georgian protesters following ""Gavrilov's Night.""",2019,June,Clearly stated campaign start within time frame,,,,2019,July,"Gavrilov’s Night': Multiple Facebook Pages Target Protests in Georgia. Medium. DFRLab, July 23, 2019. https://medium.com/dfrlab/gavrilovs-night-multiple-facebook-pages-target-protests-in-georgia-6c8bc3106822",https://medium.com/dfrlab/gavrilovs-night-multiple-facebook-pages-target-protests-in-georgia-6c8bc3106822,,,,Georgia,,,,,,,,,1,1,,Influential Individuals are Georgian protesters. Electorate is Georgian.,,-0.43,2018,No Data,No Data,No Data,No Data,,,No Data,No Data,No Data,No Data,No Data,No Data,No Data,No Data,25,2018,No Data,No Data,No Data,No Data,,,,,,,"On June 20, 2019, Sergei Gavrilov (a Russian Parliament member) visited the Georgian Parliament and sat in the speaker's chair. triggering protests in Georgia.",Sergei Gavrilov (member of the Russian Parliment) visits Georgian parliament,,,,,,,,,,,,1,,,,,,,,,,,,,,,,,,,"15 Facebook pages were analyzed. One page analyzed -- ""I Remember"" -- had over 27k followers and 24k likes.",Georgian,,,1,,,,1,1,,,,,,1,,,,,,,,,,,,,1,1,,,,,,,,,,,,,,,,,No Data,No Data,No Data,No Data,No Data,No Data,,,No Data,No Data,No Data,No Data,No Data,No Data,No Data,No Data,No Data,No Data,No Data,No Data,No Data,No Data,,,,,,,,,,,,,,,,,"To discredit pro-Georgian protests and its participants by defrauding the online communities intent. Prior to the campaign the community presented consistent partisan messaging, during the attack and to date the community page ""I Remember"" represents inconsistent and contradictory views.",1,1,,,,
6,Ukraine >>> Russia 2012,"Five Facebook pages targeted Ukraine with pro-Kremlin and socially divisive content, amplifying conspiracy theories about Ukrainian events.",2012,April,Clearly stated campaign start within time frame,2019,July,Clearly stated campaign ended within time frame,2019,July,"Facebook Takes Down the 'Voice of Truth' in Ukraine. Medium. DFRLab, July 25, 2019. https://medium.com/dfrlab/facebook-takes-down-the-voice-of-truth-in-ukraine-683fec18bfbd",https://medium.com/dfrlab/facebook-takes-down-the-voice-of-truth-in-ukraine-683fec18bfbd,,,,Ukraine,,,,1,,,,,,1,1,,,-0.07,2011,-0.09,2012,-0.78,2013,,,27.1,2012,-0.13,2011,-0.28,2012,-0.32,2013,No Data,No Data,28,2012,28,2013,,,,,,,2018 Moscow-Constantinople Schism within the Eastern Orthodox Church.,,,,,,,,,,,,1,1,,,1,,,,,,,,,,,,,,,"Four of the five Facebook pages amplified content from a single news website, golospravdy.com (or ""Voice of Truth""). This site aggregated blogs, videos, and news content that was anti-Ukrainian government and pro-Kremlin.",,,1,,,,,,,1,,,,,,,1,,,,,,,,,1,,,1,,,Activate coded to encompass the Sweets-challenge to criticize then-President Poroshenko's alleged corruption.,Russia,,,,,1,,,,,,,,,-1,2011,-0.82,2012,-0.74,2013,,,83.3,2012,-0.88,2011,-0.98,2012,-1.02,2013,52,2011,54,2012,54,2013,,,,,,,,,,,,,,,,,Pro-Kremlin and Pro-Russian messaging accompanied attacks on the Ukrainian Orthodox Church and criticisms of the Ukrainian Government.,1,1,,,,
7,Thailand >>> Russia 2010,"22 Thai Facebook and Instagram assets engaged in coordinated inauthentic behavior, pushing divisive narratives on geopolitical issues.",2010,May,,2019,July,Clearly stated campaign ended within time frame,2019,July,"Facebook Takes Down Inauthentic Pages with Connections to Thailand. Medium. DFRLab, July 25, 2019. https://medium.com/dfrlab/facebook-takes-down-inauthentic-pages-with-connections-to-thailand-7dbf331f5ba5",https://medium.com/dfrlab/facebook-takes-down-inauthentic-pages-with-connections-to-thailand-7dbf331f5ba5,,,,Thailand,,,,,,,,,,1,,,,-1.42,2009,-1.44,2010,-1.13,2011,,,-3.8,2010,-0.46,2009,-0.5,2010,-0.41,2011,No Data,No Data,No Data,No Data,61,2011,,,,,,,,,,,,,,,,,1,,1,1,1,,1,,,,,,,,,,,,,,,,"One of the external websites, journal-neo.org, posts articles on geopolitical, economic, and social issues; it is run by the Institute of Oriental Studies under the Russian Academy of Sciences (hence the 'state media' coding). Several websites, including journal-neo.org, AltThaiNews, Land Destroyer, and The New Atlas look similar and crosspost the same content.","English, Thai, Russian, Arabic",1,1,,,,,,,,,1,,,,1,,,,,,,,,1,1,,,,,,Russia,,,,,1,,,,,,,,,-0.97,2009,-0.93,2010,-1,2011,,,23.5,2010,-0.9,2009,-0.89,2010,-0.88,2011,No Data,No Data,No Data,No Data,52,2011,,,,,,,,,,,,,,,,,Spread anti-western sentiments in an attempt to polarize the Thai people and their discourse.,1,1,,,,
8,Libya >>> --- 2019,A network of more than 100 Twitter accounts exhibited inauthentic coordinated behavior by encouraging public support for Libyan General Khalifa Haftar and his self-styled Libyan National Army (LNA) while simultaneously criticizing Qatar and promoting the interests of the United Arab Emirates.,2019,April,,,,,2019,July,"“Libyan Hashtag Campaign Has Broader Designs: Trolling Qatar.” Medium. DFRLab, July 31, 2019. https://medium.com/dfrlab/libyan-hashtag-campaign-has-broader-designs-trolling-qatar-8b2ba69c7334.",https://medium.com/dfrlab/libyan-hashtag-campaign-has-broader-designs-trolling-qatar-8b2ba69c7334,,,"While some of the UAE-Qatar rivalry Twitter accounts date back to 2015, many of the accounts were created when Khalifa Haftar launched his offensive against the UN-backed Libyan government in Tripoli in April 2019, so that was coded as the starting date.",Libya,,,,,1,,,,,,,,Government - Military = the Libyan National Army (LNA) and General Khalifa Haftar,-2.44,2018,No Data,No Data,No Data,No Data,,,No Data,No Data,No Data,No Data,No Data,No Data,No Data,No Data,51,2018,No Data,No Data,No Data,No Data,,,,,,,,Intra-state war = ongoing second Libyan Civil War,Qatar,,,The campaign also criticized Qatar for the government's human rights abuses and more.,,,,,,,,,,1,,,,,,,,,,,,,,,,,The same tweet supportive of Haftar and the LNA was reposted by 90+ Twitter accounts.,"French, English",1,1,1,,,,,,1,,,,,,,1,,,,,,,These accounts evidence automation with human management.,,1,,1,,,tweets posted verbatim across the network of accounts,,,,"The campaign supported the UAE's broad regional interests, but attribution -- either directly or inferred -- was not given, so UAE was not coded.",,,,,,,,,,,No Data,No Data,No Data,No Data,No Data,No Data,,,No Data,No Data,No Data,No Data,No Data,No Data,No Data,No Data,No Data,No Data,No Data,No Data,No Data,No Data,,,,,,,,,,,,,,,,,To promote Libian General Khalifa Haftar and his Libyan National Army as well as the United Arab Emirates while criticizing Qatar and activating the UAE - Qatari rivalry online.,1,,,1,,
9,United States >>> Iran 2015,"92 Facebook assets, often engaging in political messaging, targeted the United States, United Kingdom, and Saudi Arabia in coordinated inauthentic behavior attributed to Iran.",2015,,Clearly stated campaign start within time frame,2017,,,2019,May,"Facebook Removes Iran-based Assets. Again. Medium. DFRLab. May 30, 2019. https://medium.com/dfrlab/facebook-removes-iran-based-assets-again-f17358ef21f",https://medium.com/dfrlab/facebook-removes-iran-based-assets-again-f17358ef21f,,,"The Facebook pages were taken down in May 2019, but the pages had stopped being active far before that, around 2017. Hence 2017 is coded as end date.",United States,,,,1,,1,,,,1,,,,0.58,2014,0.68,2015,0.4,2016,,,15,2015,1.07,2014,1.11,2015,1.11,2016,19,2014,19,2015,18,2016,,1,,,1,,,"Accounts active in the time leading up to the United States 2016 Presidential Election, efforts began even before those of the IRA",United Kingdom,,,"The campaign focused on British politics, and Jeremy Corbyn in particular.",Saudi Arabia,,,The campaign attacked Saudi Crown Prince Mohammed Bin Salman.,,,,1,1,,,,,,,,,,,,,,,,,,Some Facebook assets posted articles from RT and from Saudi-funded broadcaster AlArabiya.net,"English, Arabic, French",1,,1,1,1,,,,,,,,,,1,,,,,,,,,1,,,1,,1,,Iran,,,,,1,,,,,,,,,-0.87,2014,-0.93,2015,-0.81,2016,,,-1.8,2015,-1.58,2014,-1.51,2015,-1.34,2016,89,2014,87,2015,87,2016,,,,,,,,,,,,,,,,,Promote anti-Saudi Arabian narratives attacking the Crown Prince in particular. Promoting Iran and its virtues. Infiltrate domestic American political discourse and encourage partisan resentment in the time leading up to the 2016 election.,1,,,,,
10,West and Central Africa  >>> Iran 2015,"In a coordinated effort, Iranian Facebook assets amplified the Pars Today network, a multilingual radio broadcaster that is a part of Iranian state-run media. The assets targeted audiences of up to 90,000 in West and Central Africa, Europe, and South Asia, pushing both regional and international content with a strong pro-Iran slant.",2015,,,2019,March,Clearly stated campaign ended within time frame,2019,April,"Facebook Dismantled Iranian Influence Operation. Medium, DFRLab. April 19, 2019. https://medium.com/dfrlab/facebook-dismantled-iranian-influence-operation-e7ff859763a8",https://medium.com/dfrlab/facebook-dismantled-iranian-influence-operation-e7ff859763a8,,,,,West and Central Africa,,"While the campaign spanned multiple regions, many Facebook assets were in Hausa. Topics were relevant to West and Central Africa, such as discussions of political parties and leaders in Nigeria, security agreements between Sudan and South Sudan, and military interventions in the Central African Republic.",,,,,,,1,,,Target appears to be Hausa-language speakers.,No Data,No Data,No Data,No Data,No Data,No Data,,,No Data,No Data,No Data,No Data,No Data,No Data,No Data,No Data,No Data,No Data,No Data,No Data,No Data,No Data,,,,,,,,,Bangladesh,,,"While the campaign spanned multiple regions, some Facebook assets specifically targeted Bangladesh, while some specifically targeted India.",,India,,"While the campaign spanned multiple regions, some Facebook assets targeted Francophone and English-language audiences.",1,,,1,1,,,,,,,,,,,,,,,,,,"The Facebook assets reached an audience of up to 90,000 users. One Facebook page, ""Pars Today Hausa,"" had over 90,000 followers.","Kazakh, English, Hausa, Hindi, Bengali, French",1,1,1,,,,,1,,,,Region specific current events,,,1,,,,,,,,"Facebook defined the campaign as ""engaged in coordinated inauthentic behavior on Facebook."" They stated that the assets “used similar tactics by creating networks of accounts to mislead others about who they were and what they were doing.”",,,,,,1,,Iran,,,Campaign linked to the state-run IRIB (Islamic Republic of Iran Broadcasting).,1,,,,,,,,,,-0.87,2014,-0.93,2015,-0.81,2016,,,-1.8,2015,-1.58,2014,-1.51,2015,-1.34,2016,89,2014,87,2015,87,2016,,,,,,,,,,,,,,,,,Publish content in support of the Iranian government's agenda. Mislead others about who Pars Today was and what they were doing.,,1,,,,
11,India >>> --- 2019,"A pro-Modi hashtag was amplified by Twitter bots ahead of India's February 2019 general election. To a lesser extent, an anti-Modi hashtag was also amplified.",2019,February,Clearly stated campaign start within time frame,2019,Febuary,Clearly stated campaign ended within time frame,2019,April,"#ElectionWatch: Bots on Both Sides in India. Medium. DFRLab, April 9, 2019. https://medium.com/dfrlab/electionwatch-bots-on-both-sides-in-india-c87c84040229",https://medium.com/dfrlab/electionwatch-bots-on-both-sides-in-india-c87c84040229,,,campaign took place from February 9th to February 10th,India,,,,1,,1,,,,1,,,Electorate = Indian electorate was targeted ahead of the 2019 February general elections. Government civilian = Incumbent PM Narendra Modi,-0.96,2018,No Data,No Data,No Data,No Data,,,No Data,No Data,No Data,No Data,No Data,No Data,No Data,No Data,43,2018,No Data,No Data,No Data,No Data,,,,,1,,,Federal Election = February 2019 Indian general election,,,,,,,,,,,,,,1,,,,,,,,,,,,,,,,,"#TNwelcomesModi was mentioned over 777,000 times on February 9-10, 2019.","English, Tamils, Telugu",1,,1,1,,,,,,,,,,,,1,,,,,,,,,1,1,,,,,,,,,,,,,,,,,,,No Data,No Data,No Data,No Data,No Data,No Data,,,No Data,No Data,No Data,No Data,No Data,No Data,No Data,No Data,No Data,No Data,No Data,No Data,No Data,No Data,,,,,,,,,,,,,,,,,Drive engagement in partisan discourse online in the time leading up the the federal election.,1,,,,,
