23,United States >>> Russia 2017,"A hashtag decrying Morgan Freeman (after he warned that Russia was waging an information war in the United States) was perpetuated by a group associated with Russia's Internet Research Agency. RT spread the hashtag and related media, and it was then amplified on several other platforms.",2017,September,Clearly stated campaign start within time frame,,,,2018,January,"Russia’s Full Spectrum Propaganda. Medium. DFRLab, January 23, 2017. https://medium.com/dfrlab/russias-full-spectrum-propaganda-9436a246e970",https://medium.com/dfrlab/russias-full-spectrum-propaganda-9436a246e970,,,,United States,,,"Target was not clearly defined, but it is implied that the target is the United States because the disinformation repudiated Morgan Freeman's claim that Russia was waging information war on the United States.",,,,,,,1,,,,0.4,2016,0.34,2017,0.48,2018,,,18.9,2017,1.11,2016,1.05,2017,No Data,No Data,18,2016,21,2017,22,2018,,1,,,,,,,,,,,,,,,1,,1,1,,1,,,,1,,Pinterest,,,,,,,,,,,"The campaign originated from the website of a group called Agitpolk that appeared to be independent of the government (but was not, since the campaign was conducted by the Internet Research Agency, a Russian government contractor). The #StopMorganLie Twitter campaign gathered under 10,000 tweets, including retweets. The VK post was viewed 14,000 times, but liked just 124 times. RT then amplified the hashtag in an English-language article, and posted the article on Facebook, where it was picked up by:  a Pinterest page focused on socialism and politics; an aggregator site called pressaspect.com; an ostensibly travel-focused site based in Hawaii; and a site dedicated to Russians in Florida.","Russian, English",1,,,,,,1,,,,,,,1,1,1,,,,,,,"The hashtag was amplified in a variety of ways. Two Twitter accounts associated with Agitpolk -- one official, and one a sockpuppet -- boosted it. Bots amplified the hashtag, and it was then amplified by official and verified Russian government accounts.",,,,1,,,Memes were spread attacking Freeman as a hysterical and ill-informed drug user.,Russia,,,,1,,,,,,,,,,-0.95,2016,-0.64,2017,-0.5,2018,,,0,2017,-1.13,2016,-1.09,2017,No Data,No Data,65,2016,66,2017,67,2018,,1,,,,,,,,,,,,,,,To debase the claims of high profile actor Morgan Freeman after he spoke out against Russian disinformation and its threat to the United States' electoral process.,,1,,,,
24,France >>> --- 2018,A network of coordinated and inauthentic Facebook and Instagram accounts impersonated French-speaking users. The network's posts ranged from soccer and fashion tips for Muslim women to attacks on French President Emmanuel Macron.,2018,,,2018,November,Clearly stated campaign ended within time frame,2018,November,"#TrollTracker: Glimpse Into a French Operation. Medium. DFRLab, November 28, 2018. https://medium.com/dfrlab/trolltracker-glimpse-into-a-french-operation-f78dcae78924",https://medium.com/dfrlab/trolltracker-glimpse-into-a-french-operation-f78dcae78924,,,,France,,,,,,,,,,1,,,"France is the inferred target of this campaign, since the accounts posed as French-language people with interests in French politics, soccer, and more.",0.28,2017,0.11,2018,No Data,No Data,,,No Data,No Data,1.15,2017,No Data,No Data,No Data,No Data,26,2017,25,2018,No Data,No Data,,,,,,,,,,,,,,,,,,,,1,1,,,,,,,,,,,,,,,,,,"39 Facebook Accounts, 6 Facebook Pages, 99 Instagram Accounts",French,1,,1,,,,,1,,,,Geopolitical issues,,,1,,,,,,,,,,,,1,,1,,,,,"There is insufficient evidence to provide a firm attribution to the Russian Internet Research Agency; the accounts certainly behaved like troll factory accounts, but such behavior is not confined to Russian information operations.",,,,,,,,,,,No Data,No Data,No Data,No Data,No Data,No Data,,,No Data,No Data,No Data,No Data,No Data,No Data,No Data,No Data,No Data,No Data,No Data,No Data,No Data,No Data,,,,,,,,,,,,,,,,,The network of inauthentic accounts were derailed before they would be mobilized. Likely intention to create a base and spread incendiary messaging a la the Russian interference in the United States between 2014 and 2018.,,1,,,,
25,Lithuania >>> Pro-Kremlin Blogger 2018,An established Lithuanian news media outlet was hacked and a fake article depicting an alleged invasion plan of the Baltic states by NATO forces was published on the site,2018,October,Clearly stated campaign start within time frame,2018,November,Clearly stated campaign ended within time frame,2018,November,"#BalticBrief: NATO Not Planning To Invade Belarus."" Medium. DFRLab, November 21, 2018.  https://medium.com/dfrlab/balticbrief-nato-not-planning-to-invade-belarus-d694d34f04ba",https://medium.com/dfrlab/balticbrief-nato-not-planning-to-invade-belarus-d694d34f04ba,,https://kaunas.kasvyksta.lt/2018/11/08/112/portalas-kas-vyksta-kaune-patyre-kibernetine-ataka/,Citation 2 = Kas Vyksta Kaune is the first reporting.,Lithuania,,,,,,,,,,1,,,,0.78,2017,0.75,2018,No Data,No Data,,,No Data,No Data,0.99,2017,No Data,No Data,No Data,No Data,No Data,No Data,No Data,No Data,No Data,No Data,,,,,,,ongoing NATO exercise Anakonda 2018,,,,,,,,,,,1,1,,,,,,,,,9gag; :Liveleak,,,,,,,,,,Medium,The text was first published on Military International New Blog. It was planted on the Lithuanian news site Kas vyksta Kaune. It was removed as soon as the media outlet became aware of the story. Among the seven outlets which picked up the article was the pro-Kremlin news aggregator The Russophile (also known as Russia News Now).,"English, Lithuanian",,1,,,1,,,,,,,,,,1,,,,1,,,,"Hackers infiltrated the news outlet using the login credentials of a former employee. The story was also published on Medium by ""Paul Black,"" who does not have a digital footprint. It is estimated that the account is fake.",,,,1,1,,"Destructive - Discredit (binary) = Platform appropriated by disinformant to spread misleading messaging and by extension discredit the affected media outlet.
Oblique - Troll (binary) = Platform infiltrated and messaging convoluted",,,Pro-Kremlin Blogger,"The inferred hacker is Rudis Kronitis is a pro-Kremlin blogger in Latvia. He is known for disseminating disinformation and falsified information relating to NATO and Baltic states’ defense capabilities. In 2017, he published an article, which falsely accused the Lithuanian media of covering up a sex scandal that Lithuania’s Minister of Defense was allegedly involved in. In another one of his posts, he falsely accused U.S. troops of killing a child during a military exercise in Lithuania, which was quickly debunked by the Lithuanian media. Ruditis has also published editorials claiming that NATO makes Latvia vulnerable.",,,,,,1,,,,,No Data,No Data,No Data,No Data,No Data,No Data,,,No Data,No Data,No Data,No Data,No Data,No Data,No Data,No Data,No Data,No Data,No Data,No Data,No Data,No Data,,,,,,,,,,,,,,,,,Disinformation designed to spread pro-Kremlin messaging and erode trust among Baltic State nations with NATO and their neighbors. To sew discord between Baltic State nations (citing Lithuania and Latvia).,1,1,,1,,
26,United States >>> Russia,"A campaign attributed to the Internet Research Agency or “troll factory” in Russia ran over 100 accounts on Instagram and Facebook. According to traces of this activity left online, the campaign posted divisive content from all political angles, right up to the eve of the U.S. midterm elections.",,,,2018,November,Clearly stated campaign ended within time frame,2018,November,"#TrollTracker: Facebook’s Midterm Takedown. Medium. DFRLab, November 13, 2018. https://medium.com/dfrlab/trolltracker-facebooks-midterm-takedown-f3451ee5dc2",https://medium.com/dfrlab/trolltracker-facebooks-midterm-takedown-f3451ee5dc2,,,,United States,,,,,,,,,,1,,,,No Data,No Data,No Data,No Data,No Data,No Data,,,No Data,No Data,No Data,No Data,No Data,No Data,No Data,No Data,No Data,No Data,No Data,No Data,No Data,No Data,,1,,,1,,,Federal Election = American 2016 presidential election and 2018 midterms,,,,,,,,,,,,1,1,,,,,,,,,,,,,,,,,,"At least 99 Instagram accounts, 36 Facebook accounts, and six Facebook pages were taken down.",English,1,1,,,,,1,1,,,,Domestic issues,,,1,,,,,,,,,1,1,,1,1,,,Russia,,,"Initial suspicions were that the accounts were run by the Internet Research Agency or “troll factory” in St. Petersburg. A website which claimed to be affiliated to the troll factory said it ran them, although any such claim should be viewed with caution. Facebook took the accounts offline after a tip from U.S. law enforcement.",,1,,,,,,,,,No Data,No Data,No Data,No Data,No Data,No Data,,,No Data,No Data,No Data,No Data,No Data,No Data,No Data,No Data,No Data,No Data,No Data,No Data,No Data,No Data,,1,,,,,,,,,,,,,,,To build American audiences around a range of issues while furthering domestic polarization and social discord.,,1,,,,
27,Brazil >>> --- 2018,"In the months leading up to Brazil's 2018 federal election, 232 Twitter accounts propagated false information relating to Brazilian politics. The accounts belonged to international and external groups across Brazilian party lines.",2018,August,Clearly stated campaign start within time frame,2018,September,Clearly stated campaign ended within time frame,2018,November,"#ElectionWatch: FGV DAPP Uncovers Foreign Twitter Influence in Brazil. Medium. DFRLab, November 1, 2018. https://medium.com/dfrlab/electionwatch-fgv-dapp-uncovers-foreign-twitter-influence-in-brazil-7ab24e34223",https://medium.com/dfrlab/electionwatch-fgv-dapp-uncovers-foreign-twitter-influence-in-brazil-7ab24e34223,,,,Brazil,,,,1,,1,,,,1,,,,-0.42,2017,-0.36,2018,No Data,No Data,,,No Data,No Data,0.45,2017,No Data,No Data,No Data,No Data,33,2017,31,2018,No Data,No Data,,,,,1,,,Federal Election = October 2018 Brazil general elections.,,,,,,,,,1,,,,,1,,,,,,,,,,,,,,,,,"State Media = Russian media outlets including RT and Sputnik.  232 suspicious Twitter profiles were identified.  Tweets were identified in more than 40 distinct languages, and the profiles had previously tweeted about other international elections, including in Germany, the US, France, Mexico, the UK, Paraguay, and Argentina.","Portuguese, English, Spanish, Italian",1,,1,1,,,,,,,,,,,1,1,,,,,,,"A network of automated profiles from Venezuela, Argentina, Cuba and Ecuador published content supporting the Workers’ Party (PT) candidacy.
",1,1,,,,1,Astroturfing occurred in the network of automated profiles that published content in support of the Workers' Party (PT).,,,,,,,,,,,,,,,No Data,No Data,No Data,No Data,No Data,No Data,,,No Data,No Data,No Data,No Data,No Data,No Data,No Data,No Data,No Data,No Data,No Data,No Data,No Data,No Data,,,,,,,,,,,,,,,,,To influence the Brazilian 2018 general election in favor of certain candidates and parties.,1,,,,,
28,United States >>> Iran,"Facebook removed 82 pages, accounts, and groups for coordinated inauthentic behavior that originated in Iran and targeted people in the United States and United Kingdom.",,,,2018,October,Clearly stated campaign ended within time frame,2018,October,"“#TrollTracker: Facebook Uncovers Iranian Influence Operation.” Medium, DFRLab. October 26, 2018. https://medium.com/dfrlab/trolltracker-facebook-uncovers-iranian-influence-operation-d21c73cd71be.",https://medium.com/dfrlab/trolltracker-facebook-uncovers-iranian-influence-operation-d21c73cd71be,,,Starting Year (year) = two of the most popular pages were created on February 3 and April 1 2018.,United States,,,,,,,,,,1,,,"Target coded as electorate because divisive content was promoted. The accounts primarily masqueraded as American liberals, posting relevant and divisive left-leaning content.",No Data,No Data,No Data,No Data,No Data,No Data,,,No Data,No Data,No Data,No Data,No Data,No Data,No Data,No Data,No Data,No Data,No Data,No Data,No Data,No Data,,1,,,1,,,Federal Election = 2018 Midterms,United Kingdom,,,One of the taken-down Facebook accounts focused on boosting left-leaning posts in the UK.,,,,,,,,1,1,1,,,,,,,,,,,,,,,,,"82 pages, accounts, and groups were taken down in the network. Some of the Facebook pages had very large followings and many shares. For example, a page called ""I need Justice Now"" had over 13 million video views, while another, ""No Racism No War,""  had over 412,000 likes and almost half a million followers.",English,,1,1,,1,,,1,1,,,,,,1,,,,,,,,"Some of the accounts were artificially amplified, particularly the amount of their shares.",,1,,,,,,Iran,,,,,,,,,,,,,,-0.93,No Data,No Data,No Data,No Data,No Data,,,No Data,No Data,No Data,No Data,No Data,No Data,No Data,No Data,No Data,No Data,No Data,No Data,No Data,No Data,,,,,,,,,,,,,,,,,To inflame America’s partisan divides.,,1,,,,
29,United States >>> Russia 2018,"The Russian government hacked into the World Anti-Doping Agency (WADA), and exposed private information in an attempt to discredit both the WADA and American athletes. In a cyber-enabled influence operation, the leaked information was amplified by the Russian government and Kremlin-associated media to push a narrative emphasizing American hypocrisy and the deceits of the WADA.",2018,,,2018,October,Clearly stated campaign ended within time frame,2018,October,"#PutinAtWar: WADA Hack Shows Kremlin Full-Spectrum Approach. Medium. DFRLab, October 14, 2019. https://medium.com/dfrlab/putinatwar-wada-hack-shows-kremlin-full-spectrum-approach-21dd495f2e91",https://medium.com/dfrlab/putinatwar-wada-hack-shows-kremlin-full-spectrum-approach-21dd495f2e91,,,,United States,,,United States are by extension the target of defamation in this campaign,,,,,,1,,,,"Influential Individuals = American athletes that were targeted in the amplification of the hacked WADA materials, including Serena Williams, Simone Biles, and Elena Delle Donne.",0.34,2017,0.48,2018,No Data,No Data,,,No Data,No Data,1.05,2017,No Data,No Data,No Data,No Data,21,2017,22,2018,No Data,No Data,,1,,,1,,,,,,,,,,,,1,1,1,1,,1,,,,,,,,,,,,,,,,"Open Web Other - Hacker collective ""Fancy Bear"" website","The hacked content was amplified on Twitter, on a corresponding website (fancybears.net, which has subsequently been seized by the FBI), and in Kremlin-associated media such as Sputnik.","English, Russian",1,,,,1,,1,,,1,1,,,,,,,1,1,,,,,,,,1,,,,Russia,,,Attribution is not certain,1,,,,,,,,,,-0.64,2017,-0.5,2018,No Data,No Data,,,No Data,No Data,-1.09,2017,No Data,No Data,No Data,No Data,66,2017,67,2018,No Data,No Data,,1,,,,,,,,,,,,,,,"To discredit the World Anti-Doping Agency and the US by amplifying narratives about how they are hypocritical, while also mischaracterizing the actions of Russian athletes previously caught doping.",,1,,,To vilify the United States Athletes of bribery and unsportsmanlike conduct among national sports teams and athletes. To slander American athletes and support a narrative of hypocritical morals and practices.,
30,Brazil >>> --- 2018,"Bolsonaro supporters spread false information about opposition, spreading old videos with the intention to mislead. Efforts to exaggerate pro-Bolsonaro turnout and diminish ant-Bolsonaro activism repurposed old images of a Carnival parade.",2018,,,2018,,,2018,October,"#ElectionWatch: Protests Reinterpreted Online in Brazil. Medium. DFRLab, October 5, 2018 https://medium.com/dfrlab/electionwatch-protests-reinterpreted-online-in-brazil-128c6f1a9b1a.",https://medium.com/dfrlab/electionwatch-protests-reinterpreted-online-in-brazil-128c6f1a9b1a,,,,Brazil,,,,,,1,,,,1,,,,-0.42,2017,-0.36,2018,No Data,No Data,,,No Data,No Data,0.45,2017,No Data,No Data,No Data,No Data,33,2017,31,2018,No Data,No Data,,,,,1,,,Federal Election (binary) = 2018 Presidential Election,,,,,,,,,,,,1,,1,1,,,,,,,,,,,,,,,,"The false claim was amplified by FB pages such as “Por Um Brasil Melhor” (For a better Brazil), with 740,000 followers.",Portuguese,1,,1,1,,,,,,,,,,1,,,,,1,,1,,"Deceptive Content Manipulation (binary) = Images misrepresenting the size of the protest crowd
Hacking - Data Exfiltration (binary) = Women against Bolsonaro Facebook group hacked.",1,,1,,1,,"Destructive - Suppress (binary) = one of the page administrators was assaulted on September 24.
 ",,,,,,,,,,,,,,,No Data,No Data,No Data,No Data,No Data,No Data,,,No Data,No Data,No Data,No Data,No Data,No Data,No Data,No Data,No Data,No Data,No Data,No Data,No Data,No Data,,,,,,,,,,,,,,,,,To discredit the Anti-Bolsonaro base by spreading false content under the guise that it was sourced from the Bolsonaro opposition. To suppress the Balsonaro opposition by way of fabricated content and even physical violence.,1,1,,,To shift perceptions of Bolsonaro's opposition in the time leading up the 2018 presidential election,
31,North Macedonia >>> Vietnam 2018,"Ahead of the September 30, 2018 nationwide referendum to determine the countries name, Macedonia became the subject of authentic targeted behavior online as local and Vietnamese users coordinated in shaping the information space around the naming vote.",2018,September,Clearly stated campaign start within time frame,2018,September,Clearly stated campaign ended within time frame,2018,September,"#ElectionWatch: Inauthentic Activity Tested Ahead Naming Referendum. Medium. DFRLab, September 29, 2018. https://medium.com/dfrlab/electionwatch-inauthentic-activity-tested-ahead-naming-referendum-1ff6b97cb5fb",https://medium.com/dfrlab/electionwatch-inauthentic-activity-tested-ahead-naming-referendum-1ff6b97cb5fb,,,,North Macedonia,,,,,,,,,,1,,,,-0.25,2017,-0.2,2018,No Data,No Data,,,No Data,No Data,-0.14,2017,No Data,No Data,No Data,No Data,No Data,No Data,No Data,No Data,No Data,No Data,,,,,1,,,Federal Election = Macedonia's September 30 naming referendum,,,,,,,,,,,,1,,,,,,,,,,,,,,,,,,,"Negative sentiment by Vietnamese users coordinated against a live Facebook video of a local ""Yes"" campaign event in Macedonia. The main reaction they used on the video was the ""Angry"" react.",,1,,,,,,,1,,,,,,,,1,,,,,,,Botnets (binary) = appearance of online behavior symptomatic of like farm intervention.,,1,,,,1,Oblique - Flood (binary) = distract from consensus online by way of fuzzing reactions to referendum specific content.,Vietnam,,,It is unknown who the Vietnam FB users were directed by.,,,,,,,,,Like farm consisting of accounts with Vietnamese names,,0.29,2017,0.2,2018,No Data,No Data,,,No Data,No Data,-1.4,2017,No Data,No Data,No Data,No Data,76,2017,76,2018,No Data,No Data,,,,,,,,,,,,,,,,,To intercept discussion about the forthcoming nationwide referendum to change the nation's name. To create the appearance heated discord about the referendum.,1,1,,,To simulate partisanship and activate disagreement about the referendum .,
32,United States >>> Iran,A network of websites and social media pages in both English and Spanish language was traced back to Iran. The advanced distribution network published pro-Iranian content and messaging that was friendly to Iranian international and regional interests.,,,,2018,August,Clearly stated campaign ended within time frame,2018,August,"“#TrollTracker: Iran’s Suspected Information Operation.” DFRLab, Medium. August 27, 2018. https://medium.com/dfrlab/trolltracker-irans-suspected-information-operation-153fc7b60126.",https://medium.com/dfrlab/trolltracker-irans-suspected-information-operation-153fc7b60126,"“Taking Down More Coordinated Inauthentic Behavior - About Facebook.” Facebook Newsroom, Facebook. August 21, 2019. https://about.fb.com/news/2018/08/more-coordinated-inauthentic-behavior/.",https://about.fb.com/news/2018/08/more-coordinated-inauthentic-behavior/,,United States,,,"Much of the content was in English, making the English-speaking world a target here. The US is specifically coded as the target here since some pages had names like ""Berniecrats,"" meaning they were explicitly targeting an American audience. The FireEye report referenced in the text said that the target appears aimed at ""audiences in the U.S., United Kingdom, Latin America, and the Middle East.""",,,,,,,1,,,,No Data,No Data,No Data,No Data,No Data,No Data,,,No Data,No Data,No Data,No Data,No Data,No Data,No Data,No Data,No Data,No Data,No Data,No Data,No Data,No Data,,1,,,,,,,,Latin America,,"Much content was written in Spanish. One of the main implicated websites self-described itself as content specifically for Latin America. The FireEye report referenced in the text said that the target appears aimed at ""audiences in the U.S., United Kingdom, Latin America, and the Middle East.""",,,,,1,,1,1,1,1,,,,,,,,,,,,,,,,,600 Facebook pages and accounts were taken down. One big platform were seemingly independent news sites including InstitutoManquehue.org and libertyfrontpress.com.,"English, Spanish",,1,1,,1,,,1,,,,Global politics,,,1,,,,,,,,,1,1,,,,,,Iran,,,"FireEye stated that the influence operation ""appears to originate from Iran"" based on website registrant emails associated with Iranian locations and services,Twitter accounts registered using Iranian telephone numbers, and pro-Iranian content.",1,,,,,,,,,,-0.81,No Data,No Data,No Data,No Data,No Data,,,No Data,No Data,No Data,No Data,No Data,No Data,No Data,No Data,No Data,No Data,No Data,No Data,No Data,No Data,,,,,,,,,,,,,,,,,To present a specific and receptive international audience to messaging sympathetic of Iranian international and regional interests.,,1,,,"To influence opinions about intervention by the United States and the United Kingdom in the Middle East. To promote politically liberal groups to support messaging that is sympathetic to Iranian interests, likely in an effort to drive a specific electoral outcome.",
33,Mexico >>> --- 2018,"After a tie in a gubernatorial election in Puebla, Mexico, two hashtags in support of one of the candidates were amplified by bot-like accounts.",2018,July,Clearly stated campaign start within time frame,2018,July,Clearly stated campaign ended within time frame,2018,July,"#ElectionWatch: Post-Electoral Bots in Puebla. Medium. DFRLab, July 20, 2018. https://medium.com/dfrlab/electionwatch-post-electoral-bots-in-puebla-569bc88f0c0b",https://medium.com/dfrlab/electionwatch-post-electoral-bots-in-puebla-569bc88f0c0b,,,,Mexico,,,"Specifically, Puebla, Mexico",,,,,,,1,,,,-0.72,2017,-0.57,2018,No Data,No Data,,,No Data,No Data,-0.08,2017,No Data,No Data,No Data,No Data,39,2017,40,2018,No Data,No Data,,,,,,1,,State Election = July 2018 gubernatorial elections,,,,,,,,,,,,,,1,,,,,,,,,,,,,,,,,"Two hashtags were used to support one of the candidates, Martha Erika Alonso: #PueblaEligióPAN and #YoVotéXMarthaErika. This second hashtag received 16,600 mentions from 1,623 users.",Spanish,,,1,,,,,,,,,,,,,1,,,,,,,,,1,,,,1,,,,,,,,,,,,,,,,No Data,No Data,No Data,No Data,No Data,No Data,,,No Data,No Data,No Data,No Data,No Data,No Data,No Data,No Data,No Data,No Data,No Data,No Data,No Data,No Data,,,,,,,,,,,,,,,,,"To populate the narrative across party lines following Mexico's largest election. In lieu of both leading candidates declaring victory, inauthentic support and celebration online convoluted the information space in which an already questionable electoral procedure is resolved.",1,,,,Likely to amplify messaging in support of the winning candidate.,
34,United States >>> Russia 2017,"Facebook assets, sharing characteristics congruent with Russia ""troll-farm"" and the IRA activity posted divisive political content, likely with the intention sought to polarize political debate in the United States.",2017,,,2018,July,Clearly stated campaign ended within time frame,2018,August,"“#TrollTracker: Russian Traces in Facebook Takedown"" DFRLab, Medium. August 16, 2018. https://medium.com/dfrlab/trolltracker-russian-traces-in-facebook-takedown-767aac0a3483.",https://medium.com/dfrlab/trolltracker-russian-traces-in-facebook-takedown-767aac0a3483,"“Removing Bad Actors on Facebook - About Facebook,” Facebook Newsroom. July 31, 2018. https://about.fb.com/news/2018/07/removing-bad-actors-on-facebook/.",https://about.fb.com/news/2018/07/removing-bad-actors-on-facebook/,,United States,,,,,,,,,,1,,,,0.4,2016,0.34,2017,0.48,2018,,,18.9,2017,1.11,2016,1.05,2017,No Data,No Data,18,2016,21,2017,22,2018,,1,,,,,,,,,,,,,,,,,,1,,,,,,,,,,,,,,,,,,,32 Facebook pages and accounts were taken down; the DFRLab studied eight of them.,English,1,,1,,1,,,1,,,,,,,1,,,,,,,,The pages and accounts were taken down by Facebook for coordinated inauthentic behavior.,1,1,,,,,,Russia,,,,,1,,,,,,,,,-0.95,2016,-0.64,2017,-0.5,2018,,,0,2017,-1.13,2016,-1.09,2017,No Data,No Data,65,2016,66,2017,67,2018,,1,,,,,,,,,,,,,,,"Activate a liberal base in opposition to artificially circulated misogynistic, anti-feminist, and xenophobic content.",1,1,,,"To enrage, federate, and possibly mobilize a liberal audience in reaction to artificially disseminated enraging content.",
